[
  {
    "Impacto": "Alto",
    "Circuito": "Ciudadela MIA",
    "Servicio": "Agua",
    "Motivo": "Falla eléctrica en el sistema de bombeo de agua cruda del pozo de succión No. 2 que surte de agua cruda a la Planta de Tratamiento de Agua Potable de Ciudadela MIA, afectando la operación de la planta de tratamiento de agua potable PTAP de Ciudadela MIA",
    "Solicita": "ley 1712 del 6 de marzo de 2014 Ley de Transparencia y del Derecho de Acceso a la Información Pública",
    "N. Inst": 1.508,
    "Municipio": "Quibdó",
    "Dirección": "Ciudadela MIA (Sectores A, B, C, D y E)",
    "Nom Responsable": "Angélica Ibargüen",
    "Fecha y hora esperada": "01/01/2022",
    "Inicio": "2022-01-01T00:00:00",
    "Fin": "2022-01-01T01:00:00",
    "Horas": "1",
    "Estado": "CERRADA",
    "Fecha Registro": "01/01/2022",
    "Explicación": "La falla eléctrica en el sistema de bombeo de agua cruda del pozo de succión No. 2, generó suspensión del suministro durante todo el día, mientras se realizaban las gestiones para la consecución de nuevo equipo de bombeo para el pozo, para su posterior instalación y restablecimiento del servicio.",
    "Barrio": "Ciudadela MIA (Sectores A, B, C, D y E)",
    "Nom Contratista": "Aguas Nacionales EPM S.A. E.S.P. \"Proyecto Aguas del Atrato\"",
    "Tipo aviso": "Comunicado",
    "latitud": 5.728116,
    "longitud": -76.6146
  },
  {
    "Impacto": "Alto",
    "Circuito": "Ciudadela MIA",
    "Servicio": "Agua",
    "Motivo": "Condiciones adversas en el caudal de entrada de agua cruda que afectó el nivel de los tanques de almacenamiento de la Planta de Tratamiento de Agua Potable de Ciudadela MIA",
    "Solicita": "ley 1712 del 6 de marzo de 2014 Ley de Transparencia y del Derecho de Acceso a la Información Pública",
    "N. Inst": 1.508,
    "Municipio": "Quibdó",
    "Dirección": "Ciudadela MIA (Sectores A, B, C, D y E)",
    "Nom Responsable": "Angélica Ibargüen",
    "Fecha y hora esperada": "01/01/2022",
    "Inicio": "2022-01-01T13:00:00",
    "Fin": "2022-01-01T19:00:00",
    "Horas": "6",
    "Estado": "CERRADA",
    "Fecha Registro": "01/01/2022",
    "Explicación": "Las condiciones en el caudal de entrada de agua cruda afectó el nivel de los tanques de almacenamiento, por lo cual fue necesario suspender el suministro de 1:00 pm a 7:00 pm para recuperar los tanques y posteriormente restablecer el servicio",
    "Barrio": "Ciudadela MIA (Sectores A, B, C, D y E)",
    "Nom Contratista": "Aguas Nacionales EPM S.A. E.S.P. \"Proyecto Aguas del Atrato\"",
    "Tipo aviso": "Comunicado",
    "latitud": 5.736589,
    "longitud": -76.662717
  },
  {
    "Impacto": "Medio",
    "Circuito": "Niño Jesus",
    "Servicio": "Agua",
    "Motivo": "bajo nivel en el tanque de suministro de la PTAP loma por inestabilidad en los caudales desde la fuente de captacion.",
    "Solicita": "ley 1712 del 6 de marzo de 2014 Ley de Transparencia y del Derecho de Acceso a la Información Pública",
    "N. Inst": 2.32,
    "Municipio": "Quibdó",
    "Dirección": "Niño Jesús Calle Real, Balcones, Media Luna, Almendros, La Unión, Red de Inyección 1, La Semi U, La U Prima, Cr 7, Cr 8, La Normal, La T, Red de Inyección 2, Palenque, Pablo VI, Pablo VI (Macromedidor), San Vicente, Cabí, Valencia, San Martin Parte Baja y Playita.",
    "Nom Responsable": "Angélica Ibargüen",
    "Fecha y hora esperada": "05/01/2022",
    "Inicio": "2022-01-05T10:00:00",
    "Fin": "2022-01-05T12:15:00",
    "Horas": "0,09375",
    "Estado": "CERRADA",
    "Fecha Registro": "05/01/2022",
    "Explicación": "bajo nivel en el tanque de suministro de la PTAP loma por inestabilidad en los caudales desde la fuente de captacion.",
    "Barrio": "Niño Jesus",
    "Nom Contratista": "Aguas Nacionales EPM S.A. E.S.P. \"Proyecto Aguas del Atrato\"\nGestiones integrales de occidente S.A.S. E.S.P.",
    "Tipo aviso": "Comunicado",
    "latitud": 5.694248,
    "longitud": -76.645971
  },
  {
    "Impacto": "Medio",
    "Circuito": "Niño Jesus",
    "Servicio": "Agua",
    "Motivo": "levantamiento del flo en los sedimentadores de planta loma",
    "Solicita": "ley 1712 del 6 de marzo de 2014 Ley de Transparencia y del Derecho de Acceso a la Información Pública",
    "N. Inst": 2.32,
    "Municipio": "Quibdó",
    "Dirección": "Niño Jesús Calle Real, Balcones, Media Luna, Almendros, La Unión, Red de Inyección 1, La Semi U, La U Prima, Cr 7, Cr 8, La Normal, La T, Red de Inyección 2, Palenque, Pablo VI, Pablo VI (Macromedidor), San Vicente, Cabí, Valencia, San Martin Parte Baja y Playita.",
    "Nom Responsable": "Angélica Ibargüen",
    "Fecha y hora esperada": "14/01/2022",
    "Inicio": "2022-01-14T18:00:00",
    "Fin": "2022-01-14T00:00:00",
    "Horas": "0,25",
    "Estado": "CERRADA",
    "Fecha Registro": "14/01/2022",
    "Explicación": "levantamiento del flo en los sedimentadores de planta loma",
    "Barrio": "Niño Jesus",
    "Nom Contratista": "Aguas Nacionales EPM S.A. E.S.P. \"Proyecto Aguas del Atrato\"\nGestiones integrales de occidente S.A.S. E.S.P.",
    "Tipo aviso": "Comunicado",
    "latitud": 5.658341,
    "longitud": -76.631386
  },
  {
    "Impacto": "Medio",
    "Circuito": "Niño Jesus",
    "Servicio": "Agua",
    "Motivo": "bajo nivel en el tanque de suministro de la PTAP loma por inestabilidad en los caudales desde la fuente de captacion.",
    "Solicita": "ley 1712 del 6 de marzo de 2014 Ley de Transparencia y del Derecho de Acceso a la Información Pública",
    "N. Inst": 2.32,
    "Municipio": "Quibdó",
    "Dirección": "Niño Jesús Calle Real, Balcones, Media Luna, Almendros, La Unión, Red de Inyección 1, La Semi U, La U Prima, Cr 7, Cr 8, La Normal, La T, Red de Inyección 2, Palenque, Pablo VI, Pablo VI (Macromedidor), San Vicente, Cabí, Valencia, San Martin Parte Baja y Playita.",
    "Nom Responsable": "Angélica Ibargüen",
    "Fecha y hora esperada": "17/01/2022",
    "Inicio": "2022-01-17T18:00:00",
    "Fin": "2022-01-17T20:00:00",
    "Horas": "0,0833333333",
    "Estado": "CERRADA",
    "Fecha Registro": "17/01/2022",
    "Explicación": "bajo nivel en el tanque de suministro de la PTAP loma por inestabilidad en los caudales desde la fuente de captacion.",
    "Barrio": "Niño Jesus",
    "Nom Contratista": "Aguas Nacionales EPM S.A. E.S.P. \"Proyecto Aguas del Atrato\"\nGestiones integrales de occidente S.A.S. E.S.P.",
    "Tipo aviso": "Comunicado",
    "latitud": 5.728661,
    "longitud": -76.643615
  },
  {
    "Impacto": "Medio",
    "Circuito": "Niño Jesus",
    "Servicio": "Agua",
    "Motivo": "bajo nivel en el tanque de suministro de la PTAP loma por inestabilidad en los caudales desde la fuente de captacion.",
    "Solicita": "ley 1712 del 6 de marzo de 2014 Ley de Transparencia y del Derecho de Acceso a la Información Pública",
    "N. Inst": 2.32,
    "Municipio": "Quibdó",
    "Dirección": "Niño Jesús Calle Real, Balcones, Media Luna, Almendros, La Unión, Red de Inyección 1, La Semi U, La U Prima, Cr 7, Cr 8, La Normal, La T, Red de Inyección 2, Palenque, Pablo VI, Pablo VI (Macromedidor), San Vicente, Cabí, Valencia, San Martin Parte Baja y Playita.",
    "Nom Responsable": "Angélica Ibargüen",
    "Fecha y hora esperada": "18/01/2022",
    "Inicio": "2022-01-18T20:00:00",
    "Fin": "2022-01-18T22:00:00",
    "Horas": "0,1145833333",
    "Estado": "CERRADA",
    "Fecha Registro": "18/01/2022",
    "Explicación": "bajo nivel en el tanque de suministro de la PTAP loma por inestabilidad en los caudales desde la fuente de captacion.",
    "Barrio": "Niño Jesus",
    "Nom Contratista": "Aguas Nacionales EPM S.A. E.S.P. \"Proyecto Aguas del Atrato\"\nGestiones integrales de occidente S.A.S. E.S.P.",
    "Tipo aviso": "Comunicado",
    "latitud": 5.691207,
    "longitud": -76.676214
  },
  {
    "Impacto": "Medio",
    "Circuito": "Niño Jesus",
    "Servicio": "Agua",
    "Motivo": "bajo nivel en el tanque de suministro de la PTAP loma por inestabilidad en los caudales desde la fuente de captacion.",
    "Solicita": "ley 1712 del 6 de marzo de 2014 Ley de Transparencia y del Derecho de Acceso a la Información Pública",
    "N. Inst": 2.32,
    "Municipio": "Quibdó",
    "Dirección": "Niño Jesús Calle Real, Balcones, Media Luna, Almendros, La Unión, Red de Inyección 1, La Semi U, La U Prima, Cr 7, Cr 8, La Normal, La T, Red de Inyección 2, Palenque, Pablo VI, Pablo VI (Macromedidor), San Vicente, Cabí, Valencia, San Martin Parte Baja y Playita.",
    "Nom Responsable": "Angélica Ibargüen",
    "Fecha y hora esperada": "19/01/2022",
    "Inicio": "2022-01-19T16:00:00",
    "Fin": "2022-01-19T16:30:00",
    "Horas": "0,0208333333",
    "Estado": "CERRADA",
    "Fecha Registro": "19/01/2022",
    "Explicación": "bajo nivel en el tanque de suministro de la PTAP loma por inestabilidad en los caudales desde la fuente de captacion.",
    "Barrio": "Niño Jesus",
    "Nom Contratista": "Aguas Nacionales EPM S.A. E.S.P. \"Proyecto Aguas del Atrato\"\nGestiones integrales de occidente S.A.S. E.S.P.",
    "Tipo aviso": "Comunicado",
    "latitud": 5.728268,
    "longitud": -76.651634
  },
  {
    "Impacto": "Medio",
    "Circuito": "Niño Jesus",
    "Servicio": "Agua",
    "Motivo": "bajo nivel en el tanque de suministro de la PTAP loma por inestabilidad en los caudales desde la fuente de captacion.",
    "Solicita": "ley 1712 del 6 de marzo de 2014 Ley de Transparencia y del Derecho de Acceso a la Información Pública",
    "N. Inst": 2.32,
    "Municipio": "Quibdó",
    "Dirección": "Niño Jesús Calle Real, Balcones, Media Luna, Almendros, La Unión, Red de Inyección 1, La Semi U, La U Prima, Cr 7, Cr 8, La Normal, La T, Red de Inyección 2, Palenque, Pablo VI, Pablo VI (Macromedidor), San Vicente, Cabí, Valencia, San Martin Parte Baja y Playita.",
    "Nom Responsable": "Angélica Ibargüen",
    "Fecha y hora esperada": "22/01/2022",
    "Inicio": "2022-01-22T16:00:00",
    "Fin": "2022-01-22T17:00:00",
    "Horas": "0,0416666667",
    "Estado": "CERRADA",
    "Fecha Registro": "22/01/2022",
    "Explicación": "bajo nivel en el tanque de suministro de la PTAP loma por inestabilidad en los caudales desde la fuente de captacion.",
    "Barrio": "Niño Jesus",
    "Nom Contratista": "Aguas Nacionales EPM S.A. E.S.P. \"Proyecto Aguas del Atrato\"\nGestiones integrales de occidente S.A.S. E.S.P.",
    "Tipo aviso": "Comunicado",
    "latitud": 5.647946,
    "longitud": -76.647595
  },
  {
    "Impacto": "Medio",
    "Circuito": "Niño Jesus",
    "Servicio": "Agua",
    "Motivo": "suspension del fluido eletrico por parte de la empresa DISPAC",
    "Solicita": "ley 1712 del 6 de marzo de 2014 Ley de Transparencia y del Derecho de Acceso a la Información Pública",
    "N. Inst": 2.319,
    "Municipio": "Quibdó",
    "Dirección": "Niño Jesús Calle Real, Balcones, Media Luna, Almendros, La Unión, Red de Inyección 1, La Semi U, La U Prima, Cr 7, Cr 8, La Normal, La T, Red de Inyección 2, Palenque, Pablo VI, Pablo VI (Macromedidor), San Vicente, Cabí, Valencia, San Martin Parte Baja y Playita.",
    "Nom Responsable": "Anny Milena  Lozano",
    "Fecha y hora esperada": "23/04/2022",
    "Inicio": "2022-04-23T08:30:00",
    "Fin": "2022-04-23T10:00:00",
    "Horas": "0,2395833333",
    "Estado": "CERRADA",
    "Fecha Registro": "23/04/2022",
    "Explicación": "suspension del fluido eletrico por parte de la empresa DISPAC",
    "Barrio": "Niño Jesus",
    "Nom Contratista": "Aguas Nacionales EPM S.A. E.S.P. \"Proyecto Aguas del Atrato\"\nGestiones integrales de occidente S.A.S. E.S.P.",
    "Tipo aviso": "Comunicado",
    "latitud": 5.65347,
    "longitud": -76.647117
  },
  {
    "Impacto": "Medio",
    "Circuito": "Niño Jesus",
    "Servicio": "Agua",
    "Motivo": "bajo nivel en el tanque de suministro de la PTAP loma por inestabilidad en los caudales desde la fuente de captacion.",
    "Solicita": "ley 1712 del 6 de marzo de 2014 Ley de Transparencia y del Derecho de Acceso a la Información Pública",
    "N. Inst": 2.32,
    "Municipio": "Quibdó",
    "Dirección": "Niño Jesús Calle Real, Balcones, Media Luna, Almendros, La Unión, Red de Inyección 1, La Semi U, La U Prima, Cr 7, Cr 8, La Normal, La T, Red de Inyección 2, Palenque, Pablo VI, Pablo VI (Macromedidor), San Vicente, Cabí, Valencia, San Martin Parte Baja y Playita.",
    "Nom Responsable": "Angélica Ibargüen",
    "Fecha y hora esperada": "25/01/2022",
    "Inicio": "2022-01-25T17:00:00",
    "Fin": "2022-01-25T19:30:00",
    "Horas": "0,1041666667",
    "Estado": "CERRADA",
    "Fecha Registro": "25/01/2022",
    "Explicación": "bajo nivel en el tanque de suministro de la PTAP loma por inestabilidad en los caudales desde la fuente de captacion.",
    "Barrio": "Niño Jesus",
    "Nom Contratista": "Aguas Nacionales EPM S.A. E.S.P. \"Proyecto Aguas del Atrato\"\nGestiones integrales de occidente S.A.S. E.S.P.",
    "Tipo aviso": "Comunicado",
    "latitud": 5.666649,
    "longitud": -76.649038
  },
  {
    "Impacto": "Medio",
    "Circuito": "Niño Jesus",
    "Servicio": "Agua",
    "Motivo": "suspension del fluido eletrico por parte de la empresa DISPAC",
    "Solicita": "ley 1712 del 6 de marzo de 2014 Ley de Transparencia y del Derecho de Acceso a la Información Pública",
    "N. Inst": 2.32,
    "Municipio": "Quibdó",
    "Dirección": "Niño Jesús Calle Real, Balcones, Media Luna, Almendros, La Unión, Red de Inyección 1, La Semi U, La U Prima, Cr 7, Cr 8, La Normal, La T, Red de Inyección 2, Palenque, Pablo VI, Pablo VI (Macromedidor), San Vicente, Cabí, Valencia, San Martin Parte Baja y Playita.",
    "Nom Responsable": "Angélica Ibargüen",
    "Fecha y hora esperada": "30/01/2022",
    "Inicio": "2022-01-30T09:00:00",
    "Fin": "2022-01-30T16:30:00",
    "Horas": "0,3125",
    "Estado": "CERRADA",
    "Fecha Registro": "30/01/2022",
    "Explicación": "suspension del fluido eletrico por parte de la empresa DISPAC",
    "Barrio": "Niño Jesus",
    "Nom Contratista": "Aguas Nacionales EPM S.A. E.S.P. \"Proyecto Aguas del Atrato\"\nGestiones integrales de occidente S.A.S. E.S.P.",
    "Tipo aviso": "Comunicado",
    "latitud": 5.701121,
    "longitud": -76.650163
  },
  {
    "Impacto": "Medio",
    "Circuito": "Niño Jesus",
    "Servicio": "Agua",
    "Motivo": "suspension del fluido eletrico por parte de la empresa DISPAC",
    "Solicita": "ley 1712 del 6 de marzo de 2014 Ley de Transparencia y del Derecho de Acceso a la Información Pública",
    "N. Inst": 2.32,
    "Municipio": "Quibdó",
    "Dirección": "Niño Jesús Calle Real, Balcones, Media Luna, Almendros, La Unión, Red de Inyección 1, La Semi U, La U Prima, Cr 7, Cr 8, La Normal, La T, Red de Inyección 2, Palenque, Pablo VI, Pablo VI (Macromedidor), San Vicente, Cabí, Valencia, San Martin Parte Baja y Playita.",
    "Nom Responsable": "Angélica Ibargüen",
    "Fecha y hora esperada": "31/01/2022",
    "Inicio": "2022-01-31T09:00:00",
    "Fin": "2022-01-31T17:45:00",
    "Horas": "0,3645833333",
    "Estado": "CERRADA",
    "Fecha Registro": "31/01/2022",
    "Explicación": "suspension del fluido eletrico por parte de la empresa DISPAC",
    "Barrio": "Niño Jesus",
    "Nom Contratista": "Aguas Nacionales EPM S.A. E.S.P. \"Proyecto Aguas del Atrato\"\nGestiones integrales de occidente S.A.S. E.S.P.",
    "Tipo aviso": "Comunicado",
    "latitud": 5.689994,
    "longitud": -76.698567
  },
  {
    "Impacto": "Medio",
    "Circuito": "Niño Jesus",
    "Servicio": "Agua",
    "Motivo": "instalacion de dispositivo de medicion en el tanque semienterrado de planta loma",
    "Solicita": "ley 1712 del 6 de marzo de 2014 Ley de Transparencia y del Derecho de Acceso a la Información Pública",
    "N. Inst": 2.32,
    "Municipio": "Quibdó",
    "Dirección": "Niño Jesús Calle Real, Balcones, Media Luna, Almendros, La Unión, Red de Inyección 1, La Semi U, La U Prima, Cr 7, Cr 8, La Normal, La T, Red de Inyección 2, Palenque, Pablo VI, Pablo VI (Macromedidor), San Vicente, Cabí, Valencia, San Martin Parte Baja y Playita.",
    "Nom Responsable": "Angélica Ibargüen",
    "Fecha y hora esperada": "02/02/2022",
    "Inicio": "2022-02-02T10:00:00",
    "Fin": "2022-02-02T23:15:00",
    "Horas": "0,0520833333",
    "Estado": "CERRADA",
    "Fecha Registro": "02/02/2022",
    "Explicación": "instalacion de dispositivo de medicion en el tanque semienterrado de planta loma",
    "Barrio": "Niño Jesus",
    "Nom Contratista": "Aguas Nacionales EPM S.A. E.S.P. \"Proyecto Aguas del Atrato\"\nGestiones integrales de occidente S.A.S. E.S.P.",
    "Tipo aviso": "Comunicado",
    "latitud": 5.671033,
    "longitud": -76.613554
  },
  {
    "Impacto": "Medio",
    "Circuito": "Niño Jesus",
    "Servicio": "Agua",
    "Motivo": "suspension del fluido eletrico por parte de la empresa DISPAC",
    "Solicita": "ley 1712 del 6 de marzo de 2014 Ley de Transparencia y del Derecho de Acceso a la Información Pública",
    "N. Inst": 2.32,
    "Municipio": "Quibdó",
    "Dirección": "Niño Jesús Calle Real, Balcones, Media Luna, Almendros, La Unión, Red de Inyección 1, La Semi U, La U Prima, Cr 7, Cr 8, La Normal, La T, Red de Inyección 2, Palenque, Pablo VI, Pablo VI (Macromedidor), San Vicente, Cabí, Valencia, San Martin Parte Baja y Playita.",
    "Nom Responsable": "Angélica Ibargüen",
    "Fecha y hora esperada": "06/02/2022",
    "Inicio": "2022-02-06T08:30:00",
    "Fin": "2022-02-07T00:00:00",
    "Horas": "0,625",
    "Estado": "CERRADA",
    "Fecha Registro": "06/02/2022",
    "Explicación": "suspension del fluido eletrico por parte de la empresa DISPAC",
    "Barrio": "Niño Jesus",
    "Nom Contratista": "Aguas Nacionales EPM S.A. E.S.P. \"Proyecto Aguas del Atrato\"\nGestiones integrales de occidente S.A.S. E.S.P.",
    "Tipo aviso": "Comunicado",
    "latitud": 5.671606,
    "longitud": -76.615971
  },
  {
    "Impacto": "Alto",
    "Circuito": "Ciudadela MIA",
    "Servicio": "Agua",
    "Motivo": "Mantenimiento de los pozos de succión de la PTAP de Ciudadela MIA",
    "Solicita": "ley 1712 del 6 de marzo de 2014 Ley de Transparencia y del Derecho de Acceso a la Información Pública",
    "N. Inst": 1.508,
    "Municipio": "Quibdó",
    "Dirección": "Ciudadela MIA (Sectores A, B, C, D y E)",
    "Nom Responsable": "Angélica Ibargüen",
    "Fecha y hora esperada": "08/02/2022",
    "Inicio": "2022-02-08T07:00:00",
    "Fin": "2022-02-08T17:00:00",
    "Horas": "0,4166666667",
    "Estado": "CERRADA",
    "Fecha Registro": "08/02/2022",
    "Explicación": "El mantenimiento de los pozos de succión de la PTAP de Ciudadela MIA, obligó a la suspension del servicio desde las 07:00 am hasta las 05:00 pm.",
    "Barrio": "Ciudadela MIA (Sectores A, B, C, D y E)",
    "Nom Contratista": "Aguas Nacionales EPM S.A. E.S.P. \"Proyecto Aguas del Atrato\"",
    "Tipo aviso": "Comunicado",
    "latitud": 5.660384,
    "longitud": -76.680337
  },
  {
    "Impacto": "Medio",
    "Circuito": "Niño Jesus",
    "Servicio": "Agua",
    "Motivo": "suspension del fluido eletrico por parte de la empresa DISPAC",
    "Solicita": "ley 1712 del 6 de marzo de 2014 Ley de Transparencia y del Derecho de Acceso a la Información Pública",
    "N. Inst": 2.32,
    "Municipio": "Quibdó",
    "Dirección": "Niño Jesús Calle Real, Balcones, Media Luna, Almendros, La Unión, Red de Inyección 1, La Semi U, La U Prima, Cr 7, Cr 8, La Normal, La T, Red de Inyección 2, Palenque, Pablo VI, Pablo VI (Macromedidor), San Vicente, Cabí, Valencia, San Martin Parte Baja y Playita.",
    "Nom Responsable": "Angélica Ibargüen",
    "Fecha y hora esperada": "07/02/2022",
    "Inicio": "2022-02-07T00:00:00",
    "Fin": "2022-02-07T05:15:00",
    "Horas": "0,71875",
    "Estado": "CERRADA",
    "Fecha Registro": "07/02/2022",
    "Explicación": "suspension del fluido eletrico por parte de la empresa DISPAC",
    "Barrio": "Niño Jesus",
    "Nom Contratista": "Aguas Nacionales EPM S.A. E.S.P. \"Proyecto Aguas del Atrato\"\nGestiones integrales de occidente S.A.S. E.S.P.",
    "Tipo aviso": "Comunicado",
    "latitud": 5.698054,
    "longitud": -76.629129
  },
  {
    "Impacto": "Medio",
    "Circuito": "Niño Jesus",
    "Servicio": "Agua",
    "Motivo": "bajo nivel en el tanque de suministro de la PTAP loma por inestabilidad en los caudales desde la fuente de captacion.",
    "Solicita": "ley 1712 del 6 de marzo de 2014 Ley de Transparencia y del Derecho de Acceso a la Información Pública",
    "N. Inst": 2.32,
    "Municipio": "Quibdó",
    "Dirección": "Niño Jesús Calle Real, Balcones, Media Luna, Almendros, La Unión, Red de Inyección 1, La Semi U, La U Prima, Cr 7, Cr 8, La Normal, La T, Red de Inyección 2, Palenque, Pablo VI, Pablo VI (Macromedidor), San Vicente, Cabí, Valencia, San Martin Parte Baja y Playita.",
    "Nom Responsable": "Angélica Ibargüen",
    "Fecha y hora esperada": "15/02/2022",
    "Inicio": "2022-02-15T16:00:00",
    "Fin": "2022-02-15T17:45:00",
    "Horas": "0,0729166667",
    "Estado": "CERRADA",
    "Fecha Registro": "15/02/2022",
    "Explicación": "bajo nivel en el tanque de suministro de la PTAP loma por inestabilidad en los caudales desde la fuente de captacion.",
    "Barrio": "Niño Jesus",
    "Nom Contratista": "Aguas Nacionales EPM S.A. E.S.P. \"Proyecto Aguas del Atrato\"\nGestiones integrales de occidente S.A.S. E.S.P.",
    "Tipo aviso": "Comunicado",
    "latitud": 5.66378,
    "longitud": -76.621576
  },
  {
    "Impacto": "Medio",
    "Circuito": "Ciudadela MIA",
    "Servicio": "Agua",
    "Motivo": "Suspensión indefinida de la operación  por situación de orden público que afectó el normal desarrollo de las actividades que realiza el personal operativo",
    "Solicita": "ley 1712 del 6 de marzo de 2014 Ley de Transparencia y del Derecho de Acceso a la Información Pública",
    "N. Inst": 1.508,
    "Municipio": "Quibdó",
    "Dirección": "Ciudadela MIA (Sectores A, B, C, D y E)",
    "Nom Responsable": "Angélica Ibargüen",
    "Fecha y hora esperada": "15/02/2022",
    "Inicio": "2022-02-15T16:00:00",
    "Fin": "2022-02-15T23:59:00",
    "Horas": "0,3333333333",
    "Estado": "CERRADA",
    "Fecha Registro": "15/02/2022",
    "Explicación": "Por situación de orden público que afectó el normal desarrollo de las actividades que realiza el personal operativo, fue necesario suspender por completo la operación lo que generó la suspensión del servicio indefinidamente desde las 04:00 pm",
    "Barrio": "Ciudadela MIA (Sectores A, B, C, D y E)",
    "Nom Contratista": "Aguas Nacionales EPM S.A. E.S.P. \"Proyecto Aguas del Atrato\"",
    "Tipo aviso": "Comunicado",
    "latitud": 5.664421,
    "longitud": -76.621237
  },
  {
    "Impacto": "Alto",
    "Circuito": "Ciudadela MIA",
    "Servicio": "Agua",
    "Motivo": "Suspensión indefinida de la operación  por situación de orden público que afectó el normal desarrollo de las actividades que realiza el personal operativo",
    "Solicita": "ley 1712 del 6 de marzo de 2014 Ley de Transparencia y del Derecho de Acceso a la Información Pública",
    "N. Inst": 1.508,
    "Municipio": "Quibdó",
    "Dirección": "Ciudadela MIA (Sectores A, B, C, D y E)",
    "Nom Responsable": "Angélica Ibargüen",
    "Fecha y hora esperada": "16/02/2022",
    "Inicio": "2022-02-16T00:00:00",
    "Fin": "2022-02-16T23:59:00",
    "Horas": "24",
    "Estado": "CERRADA",
    "Fecha Registro": "16/02/2022",
    "Explicación": "Por situación de orden público que afectó el normal desarrollo de las actividades que realiza el personal operativo, fue necesario suspender por completo la operación lo que generó la suspensión del servicio indefinidamente desde las 04:00 pm",
    "Barrio": "Ciudadela MIA (Sectores A, B, C, D y E)",
    "Nom Contratista": "Aguas Nacionales EPM S.A. E.S.P. \"Proyecto Aguas del Atrato\"",
    "Tipo aviso": "Comunicado",
    "latitud": 5.730534,
    "longitud": -76.615287
  },
  {
    "Impacto": "Alto",
    "Circuito": "Ciudadela MIA",
    "Servicio": "Agua",
    "Motivo": "Suspensión indefinida de la operación  por situación de orden público que afectó el normal desarrollo de las actividades que realiza el personal operativo",
    "Solicita": "ley 1712 del 6 de marzo de 2014 Ley de Transparencia y del Derecho de Acceso a la Información Pública",
    "N. Inst": 1.508,
    "Municipio": "Quibdó",
    "Dirección": "Ciudadela MIA (Sectores A, B, C, D y E)",
    "Nom Responsable": "Angélica Ibargüen",
    "Fecha y hora esperada": "17/02/2022",
    "Inicio": "2022-02-17T00:00:00",
    "Fin": "2022-02-17T23:59:00",
    "Horas": "24",
    "Estado": "CERRADA",
    "Fecha Registro": "17/02/2022",
    "Explicación": "Por situación de orden público que afectó el normal desarrollo de las actividades que realiza el personal operativo, fue necesario suspender por completo la operación lo que generó la suspensión del servicio indefinidamente",
    "Barrio": "Ciudadela MIA (Sectores A, B, C, D y E)",
    "Nom Contratista": "Aguas Nacionales EPM S.A. E.S.P. \"Proyecto Aguas del Atrato\"",
    "Tipo aviso": "Comunicado",
    "latitud": 5.695546,
    "longitud": -76.609277
  },
  {
    "Impacto": "Medio",
    "Circuito": "Niño Jesus",
    "Servicio": "Agua",
    "Motivo": "bajo nivel en el tanque de suministro de la PTAP loma por inestabilidad en los caudales desde la fuente de captacion.",
    "Solicita": "ley 1712 del 6 de marzo de 2014 Ley de Transparencia y del Derecho de Acceso a la Información Pública",
    "N. Inst": 2.32,
    "Municipio": "Quibdó",
    "Dirección": "Niño Jesús Calle Real, Balcones, Media Luna, Almendros, La Unión, Red de Inyección 1, La Semi U, La U Prima, Cr 7, Cr 8, La Normal, La T, Red de Inyección 2, Palenque, Pablo VI, Pablo VI (Macromedidor), San Vicente, Cabí, Valencia, San Martin Parte Baja y Playita.",
    "Nom Responsable": "Angélica Ibargüen",
    "Fecha y hora esperada": "17/02/2022",
    "Inicio": "2022-02-17T14:30:00",
    "Fin": "2022-02-17T18:00:00",
    "Horas": "0,1458333333",
    "Estado": "CERRADA",
    "Fecha Registro": "17/02/2022",
    "Explicación": "bajo nivel en el tanque de suministro de la PTAP loma por inestabilidad en los caudales desde la fuente de captacion.",
    "Barrio": "Niño Jesus",
    "Nom Contratista": "Aguas Nacionales EPM S.A. E.S.P. \"Proyecto Aguas del Atrato\"\nGestiones integrales de occidente S.A.S. E.S.P.",
    "Tipo aviso": "Comunicado",
    "latitud": 5.73602,
    "longitud": -76.620285
  },
  {
    "Impacto": "Alto",
    "Circuito": "Ciudadela MIA",
    "Servicio": "Agua",
    "Motivo": "Suspensión indefinida de la operación  por situación de orden público que afectó el normal desarrollo de las actividades que realiza el personal operativo",
    "Solicita": "ley 1712 del 6 de marzo de 2014 Ley de Transparencia y del Derecho de Acceso a la Información Pública",
    "N. Inst": 1.508,
    "Municipio": "Quibdó",
    "Dirección": "Ciudadela MIA (Sectores A, B, C, D y E)",
    "Nom Responsable": "Angélica Ibargüen",
    "Fecha y hora esperada": "18/02/2022",
    "Inicio": "2022-02-18T00:00:00",
    "Fin": "2022-02-18T17:30:00",
    "Horas": "0,7291666667",
    "Estado": "CERRADA",
    "Fecha Registro": "18/02/2022",
    "Explicación": "Por situación de orden público que afectó el normal desarrollo de las actividades que realiza el personal operativo, fue necesario suspender por completo la operación, lo que generó la suspensión del servicio indefinidamente. No obstante, a partir del día 18 de febrero, luego de acuerdos con la Alcaldía de Quibdó, el Personero Municipal, EPQ en Liquidación, lideres de Ciudadela MIA y directivas del proyecto Aguas del Atrato se reanudó suministro a partir de las 05:30 pm",
    "Barrio": "Ciudadela MIA (Sectores A, B, C, D y E)",
    "Nom Contratista": "Aguas Nacionales EPM S.A. E.S.P. \"Proyecto Aguas del Atrato\"",
    "Tipo aviso": "Comunicado",
    "latitud": 5.655787,
    "longitud": -76.666925
  },
  {
    "Impacto": "Medio",
    "Circuito": "Niño Jesus",
    "Servicio": "Agua",
    "Motivo": "suspesion del sistema de cloracion de la PTAP loma",
    "Solicita": "ley 1712 del 6 de marzo de 2014 Ley de Transparencia y del Derecho de Acceso a la Información Pública",
    "N. Inst": 2.32,
    "Municipio": "Quibdó",
    "Dirección": "Niño Jesús Calle Real, Balcones, Media Luna, Almendros, La Unión, Red de Inyección 1, La Semi U, La U Prima, Cr 7, Cr 8, La Normal, La T, Red de Inyección 2, Palenque, Pablo VI, Pablo VI (Macromedidor), San Vicente, Cabí, Valencia, San Martin Parte Baja y Playita.",
    "Nom Responsable": "Angélica Ibargüen",
    "Fecha y hora esperada": "19/02/2022",
    "Inicio": "2022-02-19T07:00:00",
    "Fin": "2022-02-19T11:45:00",
    "Horas": "0,1979166667",
    "Estado": "CERRADA",
    "Fecha Registro": "19/02/2022",
    "Explicación": "suspesion del sistema de cloracion de la PTAP loma",
    "Barrio": "Niño Jesus",
    "Nom Contratista": "Aguas Nacionales EPM S.A. E.S.P. \"Proyecto Aguas del Atrato\"\nGestiones integrales de occidente S.A.S. E.S.P.",
    "Tipo aviso": "Comunicado",
    "latitud": 5.685308,
    "longitud": -76.645131
  },
  {
    "Impacto": "Medio",
    "Circuito": "Niño Jesus",
    "Servicio": "Agua",
    "Motivo": "suspesion del sistema de cloracion de la PTAP loma",
    "Solicita": "ley 1712 del 6 de marzo de 2014 Ley de Transparencia y del Derecho de Acceso a la Información Pública",
    "N. Inst": 2.32,
    "Municipio": "Quibdó",
    "Dirección": "Niño Jesús Calle Real, Balcones, Media Luna, Almendros, La Unión, Red de Inyección 1, La Semi U, La U Prima, Cr 7, Cr 8, La Normal, La T, Red de Inyección 2, Palenque, Pablo VI, Pablo VI (Macromedidor), San Vicente, Cabí, Valencia, San Martin Parte Baja y Playita.",
    "Nom Responsable": "Angélica Ibargüen",
    "Fecha y hora esperada": "23/02/2022",
    "Inicio": "2022-02-23T07:00:00",
    "Fin": "2022-02-19T11:00:00",
    "Horas": "0,1666666667",
    "Estado": "CERRADA",
    "Fecha Registro": "23/02/2022",
    "Explicación": "suspesion del sistema de cloracion de la PTAP loma",
    "Barrio": "Niño Jesus",
    "Nom Contratista": "Aguas Nacionales EPM S.A. E.S.P. \"Proyecto Aguas del Atrato\"\nGestiones integrales de occidente S.A.S. E.S.P.",
    "Tipo aviso": "Comunicado",
    "latitud": 5.656479,
    "longitud": -76.701441
  },
  {
    "Impacto": "Medio",
    "Circuito": "Niño Jesus",
    "Servicio": "Agua",
    "Motivo": "Lavado y desinfección del tanque semienterrado de distribución en la planta de tratamiento de agua potable Playita I y el tanque elevado de planta Loma, dando cumplimiento al decreto 1575 del 2007 artículo 8 y 9, “Por el cual se establece el Sistema para la Protección y Control de la Calidad del Agua para Consumo Humano”. Numeral 2. Lavar y desinfectar antes de la puesta en funcionamiento y como mínimo dos (2) veces al año, los tanques de almacenamiento de agua tratada.",
    "Solicita": "ley 1712 del 6 de marzo de 2014 Ley de Transparencia y del Derecho de Acceso a la Información Pública",
    "N. Inst": 2.32,
    "Municipio": "Quibdó",
    "Dirección": "Niño Jesús Calle Real, Balcones, Media Luna, Almendros, La Unión, Red de Inyección 1, La Semi U, La U Prima, Cr 7, Cr 8, La Normal, La T, Red de Inyección 2, Palenque, Pablo VI, Pablo VI (Macromedidor), San Vicente, Cabí, Valencia, San Martin Parte Baja y Playita.",
    "Nom Responsable": "Angélica Ibargüen",
    "Fecha y hora esperada": "24/02/2022",
    "Inicio": "2022-02-24T10:00:00",
    "Fin": "2022-02-24T15:00:00",
    "Horas": "0,2083333333",
    "Estado": "CERRADA",
    "Fecha Registro": "24/02/2022",
    "Explicación": "Lavado y desinfección del tanque semienterrado de distribución en la planta de tratamiento de agua potable Playita I y el tanque elevado de planta Loma, dando cumplimiento al decreto 1575 del 2007 artículo 8 y 9, “Por el cual se establece el Sistema para la Protección y Control de la Calidad del Agua para Consumo Humano”. Numeral 2. Lavar y desinfectar antes de la puesta en funcionamiento y como mínimo dos (2) veces al año, los tanques de almacenamiento de agua tratada.",
    "Barrio": "Niño Jesus",
    "Nom Contratista": "Aguas Nacionales EPM S.A. E.S.P. \"Proyecto Aguas del Atrato\"\nGestiones integrales de occidente S.A.S. E.S.P.",
    "Tipo aviso": "Comunicado",
    "latitud": 5.669219,
    "longitud": -76.653291
  },
  {
    "Impacto": "Medio",
    "Circuito": "Ciudadela MIA",
    "Servicio": "Agua",
    "Motivo": "Mantenimiento del pozo de succión No. 2, el cual surte de agua cruda a la Planta de Tratamiento de Agua Potable – PTAP",
    "Solicita": "ley 1712 del 6 de marzo de 2014 Ley de Transparencia y del Derecho de Acceso a la Información Pública",
    "N. Inst": 1.508,
    "Municipio": "Quibdó",
    "Dirección": "Ciudadela MIA (Sectores A, B, C, D y E)",
    "Nom Responsable": "Angélica Ibargüen",
    "Fecha y hora esperada": "28/02/2022",
    "Inicio": "2022-02-28T09:45:00",
    "Fin": "2022-02-28T23:59:00",
    "Horas": "7,25",
    "Estado": "CERRADA",
    "Fecha Registro": "28/02/2022",
    "Explicación": "Por mantenimiento del pozo de succión No. 2, el cual surte de agua cruda a la Planta de Tratamiento de Agua Potable – PTAP, fue necesario realizar racionamiento del servicio de acueducto a la comunidad de Ciudadela MIA",
    "Barrio": "Ciudadela MIA (Sectores A, B, C, D y E)",
    "Nom Contratista": "Aguas Nacionales EPM S.A. E.S.P. \"Proyecto Aguas del Atrato\"",
    "Tipo aviso": "Comunicado",
    "latitud": 5.737634,
    "longitud": -76.682808
  },
  {
    "Impacto": "Alto",
    "Circuito": "Ciudadela MIA",
    "Servicio": "Agua",
    "Motivo": "Mantenimiento del pozo de succión No. 2, el cual surte de agua cruda a la Planta de Tratamiento de Agua Potable – PTAP\n\nLavado y desinfección de los tanques elevados de almacenamiento de la PTAP, dando cumplimiento al decreto 1575 del 2007 artículo 8 y 9, “Por el cual se establece el Sistema para la Protección y Control de la Calidad del Agua para Consumo Humano”.",
    "Solicita": "ley 1712 del 6 de marzo de 2014 Ley de Transparencia y del Derecho de Acceso a la Información Pública",
    "N. Inst": 1.508,
    "Municipio": "Quibdó",
    "Dirección": "Ciudadela MIA (Sectores A, B, C, D y E)",
    "Nom Responsable": "Angélica Ibargüen",
    "Fecha y hora esperada": "01/03/2022",
    "Inicio": "2022-03-01T00:00:00",
    "Fin": "2022-03-01T23:59:00",
    "Horas": "15,23",
    "Estado": "CERRADA",
    "Fecha Registro": "01/03/2022",
    "Explicación": "Por mantenimiento del pozo de succión No. 2, el cual surte de agua cruda a la Planta de Tratamiento de Agua Potable – PTAP y  el lavado y desinfección de los tanques elevados de almacenamiento, fue necesario realizar racionamiento del servicio de acueducto a la comunidad de Ciudadela MIA",
    "Barrio": "Ciudadela MIA (Sectores A, B, C, D y E)",
    "Nom Contratista": "Aguas Nacionales EPM S.A. E.S.P. \"Proyecto Aguas del Atrato\"",
    "Tipo aviso": "Comunicado",
    "latitud": 5.64409,
    "longitud": -76.658496
  },
  {
    "Impacto": "Medio",
    "Circuito": "Niño Jesus",
    "Servicio": "Agua",
    "Motivo": "suspension del fluido eletrico por parte de la empresa DISPAC",
    "Solicita": "ley 1712 del 6 de marzo de 2014 Ley de Transparencia y del Derecho de Acceso a la Información Pública",
    "N. Inst": 2.32,
    "Municipio": "Quibdó",
    "Dirección": "Niño Jesús Calle Real, Balcones, Media Luna, Almendros, La Unión, Red de Inyección 1, La Semi U, La U Prima, Cr 7, Cr 8, La Normal, La T, Red de Inyección 2, Palenque, Pablo VI, Pablo VI (Macromedidor), San Vicente, Cabí, Valencia, San Martin Parte Baja y Playita.",
    "Nom Responsable": "Angélica Ibargüen",
    "Fecha y hora esperada": "01/03/2022",
    "Inicio": "2022-03-01T08:30:00",
    "Fin": "2022-03-01T17:00:00",
    "Horas": "0,3541666667",
    "Estado": "CERRADA",
    "Fecha Registro": "01/03/2022",
    "Explicación": "suspension del fluido eletrico por parte de la empresa DISPAC",
    "Barrio": "Niño Jesus",
    "Nom Contratista": "Aguas Nacionales EPM S.A. E.S.P. \"Proyecto Aguas del Atrato\"\nGestiones integrales de occidente S.A.S. E.S.P.",
    "Tipo aviso": "Comunicado",
    "latitud": 5.655395,
    "longitud": -76.664791
  },
  {
    "Impacto": "Alto",
    "Circuito": "Ciudadela MIA",
    "Servicio": "Agua",
    "Motivo": "Mantenimiento del pozo de succión No. 2, el cual surte de agua cruda a la Planta de Tratamiento de Agua Potable – PTAP",
    "Solicita": "ley 1712 del 6 de marzo de 2014 Ley de Transparencia y del Derecho de Acceso a la Información Pública",
    "N. Inst": 1.508,
    "Municipio": "Quibdó",
    "Dirección": "Ciudadela MIA (Sectores A, B, C, D y E)",
    "Nom Responsable": "Angélica Ibargüen",
    "Fecha y hora esperada": "02/03/2022",
    "Inicio": "2022-03-02T00:00:00",
    "Fin": "2022-03-02T23:59:00",
    "Horas": "17,23",
    "Estado": "CERRADA",
    "Fecha Registro": "02/03/2022",
    "Explicación": "Por mantenimiento del pozo de succión No. 2, el cual surte de agua cruda a la Planta de Tratamiento de Agua Potable – PTAP, fue necesario realizar racionamiento del servicio de acueducto a la comunidad de Ciudadela MIA",
    "Barrio": "Ciudadela MIA (Sectores A, B, C, D y E)",
    "Nom Contratista": "Aguas Nacionales EPM S.A. E.S.P. \"Proyecto Aguas del Atrato\"",
    "Tipo aviso": "Comunicado",
    "latitud": 5.696823,
    "longitud": -76.696284
  },
  {
    "Impacto": "Alto",
    "Circuito": "Ciudadela MIA",
    "Servicio": "Agua",
    "Motivo": "Mantenimiento del pozo de succión No. 2, el cual surte de agua cruda a la Planta de Tratamiento de Agua Potable – PTAP",
    "Solicita": "ley 1712 del 6 de marzo de 2014 Ley de Transparencia y del Derecho de Acceso a la Información Pública",
    "N. Inst": 1.508,
    "Municipio": "Quibdó",
    "Dirección": "Ciudadela MIA (Sectores A, B, C, D y E)",
    "Nom Responsable": "Angélica Ibargüen",
    "Fecha y hora esperada": "03/03/2022",
    "Inicio": "2022-03-03T00:00:00",
    "Fin": "2022-03-03T23:59:00",
    "Horas": "21",
    "Estado": "CERRADA",
    "Fecha Registro": "03/03/2022",
    "Explicación": "Por mantenimiento del pozo de succión No. 2, el cual surte de agua cruda a la Planta de Tratamiento de Agua Potable – PTAP, fue necesario realizar racionamiento del servicio de acueducto a la comunidad de Ciudadela MIA",
    "Barrio": "Ciudadela MIA (Sectores A, B, C, D y E)",
    "Nom Contratista": "Aguas Nacionales EPM S.A. E.S.P. \"Proyecto Aguas del Atrato\"",
    "Tipo aviso": "Comunicado",
    "latitud": 5.643701,
    "longitud": -76.642294
  },
  {
    "Impacto": "Medio",
    "Circuito": "Niño Jesus",
    "Servicio": "Agua",
    "Motivo": "Lavado y desinfección del tanque semienterrado de distribución en la planta de tratamiento de agua potable Playita I y el tanque elevado de planta Loma, dando cumplimiento al decreto 1575 del 2007 artículo 8 y 9, “Por el cual se establece el Sistema para la Protección y Control de la Calidad del Agua para Consumo Humano”. Numeral 2. Lavar y desinfectar antes de la puesta en funcionamiento y como mínimo dos (2) veces al año, los tanques de almacenamiento de agua tratada.",
    "Solicita": "ley 1712 del 6 de marzo de 2014 Ley de Transparencia y del Derecho de Acceso a la Información Pública",
    "N. Inst": 2.32,
    "Municipio": "Quibdó",
    "Dirección": "Niño Jesús Calle Real, Balcones, Media Luna, Almendros, La Unión, Red de Inyección 1, La Semi U, La U Prima, Cr 7, Cr 8, La Normal, La T, Red de Inyección 2, Palenque, Pablo VI, Pablo VI (Macromedidor), San Vicente, Cabí, Valencia, San Martin Parte Baja y Playita.",
    "Nom Responsable": "Angélica Ibargüen",
    "Fecha y hora esperada": "03/03/2022",
    "Inicio": "2022-03-03T08:00:00",
    "Fin": "2022-03-03T22:00:00",
    "Horas": "0,4166666667",
    "Estado": "CERRADA",
    "Fecha Registro": "03/03/2022",
    "Explicación": "Lavado y desinfección del tanque semienterrado de distribución en la planta de tratamiento de agua potable Playita I y el tanque elevado de planta Loma, dando cumplimiento al decreto 1575 del 2007 artículo 8 y 9, “Por el cual se establece el Sistema para la Protección y Control de la Calidad del Agua para Consumo Humano”. Numeral 2. Lavar y desinfectar antes de la puesta en funcionamiento y como mínimo dos (2) veces al año, los tanques de almacenamiento de agua tratada.",
    "Barrio": "Niño Jesus",
    "Nom Contratista": "Aguas Nacionales EPM S.A. E.S.P. \"Proyecto Aguas del Atrato\"\nGestiones integrales de occidente S.A.S. E.S.P.",
    "Tipo aviso": "Comunicado",
    "latitud": 5.740797,
    "longitud": -76.6086
  },
  {
    "Impacto": "Alto",
    "Circuito": "Ciudadela MIA",
    "Servicio": "Agua",
    "Motivo": "Mantenimiento del pozo de succión No. 2, el cual surte de agua cruda a la Planta de Tratamiento de Agua Potable – PTAP",
    "Solicita": "ley 1712 del 6 de marzo de 2014 Ley de Transparencia y del Derecho de Acceso a la Información Pública",
    "N. Inst": 1.508,
    "Municipio": "Quibdó",
    "Dirección": "Ciudadela MIA (Sectores A, B, C, D y E)",
    "Nom Responsable": "Angélica Ibargüen",
    "Fecha y hora esperada": "04/03/2022",
    "Inicio": "2022-03-04T00:00:00",
    "Fin": "2022-03-04T23:59:00",
    "Horas": "17,78",
    "Estado": "CERRADA",
    "Fecha Registro": "04/03/2022",
    "Explicación": "Por mantenimiento del pozo de succión No. 2, el cual surte de agua cruda a la Planta de Tratamiento de Agua Potable – PTAP, fue necesario realizar racionamiento del servicio de acueducto a la comunidad de Ciudadela MIA",
    "Barrio": "Ciudadela MIA (Sectores A, B, C, D y E)",
    "Nom Contratista": "Aguas Nacionales EPM S.A. E.S.P. \"Proyecto Aguas del Atrato\"",
    "Tipo aviso": "Comunicado",
    "latitud": 5.699357,
    "longitud": -76.672857
  },
  {
    "Impacto": "Medio",
    "Circuito": "Ciudadela MIA",
    "Servicio": "Agua",
    "Motivo": "Mantenimiento del pozo de succión No. 2, el cual surte de agua cruda a la Planta de Tratamiento de Agua Potable – PTAP",
    "Solicita": "ley 1712 del 6 de marzo de 2014 Ley de Transparencia y del Derecho de Acceso a la Información Pública",
    "N. Inst": 1.508,
    "Municipio": "Quibdó",
    "Dirección": "Ciudadela MIA (Sectores A, B, C, D y E)",
    "Nom Responsable": "Angélica Ibargüen",
    "Fecha y hora esperada": "05/03/2022",
    "Inicio": "2022-03-05T00:00:00",
    "Fin": "2022-03-05T06:20:00",
    "Horas": "6,33",
    "Estado": "CERRADA",
    "Fecha Registro": "05/03/2022",
    "Explicación": "Por mantenimiento del pozo de succión No. 2, el cual surte de agua cruda a la Planta de Tratamiento de Agua Potable – PTAP, fue necesario realizar racionamiento del servicio de acueducto a la comunidad de Ciudadela MIA",
    "Barrio": "Ciudadela MIA (Sectores A, B, C, D y E)",
    "Nom Contratista": "Aguas Nacionales EPM S.A. E.S.P. \"Proyecto Aguas del Atrato\"",
    "Tipo aviso": "Comunicado",
    "latitud": 5.715835,
    "longitud": -76.691405
  },
  {
    "Impacto": "Medio",
    "Circuito": "Niño Jesus",
    "Servicio": "Agua",
    "Motivo": "bajo nivel en el tanque de suministro de la PTAP loma por inestabilidad en los caudales desde la fuente de captacion.",
    "Solicita": "ley 1712 del 6 de marzo de 2014 Ley de Transparencia y del Derecho de Acceso a la Información Pública",
    "N. Inst": 2.32,
    "Municipio": "Quibdó",
    "Dirección": "Niño Jesús Calle Real, Balcones, Media Luna, Almendros, La Unión, Red de Inyección 1, La Semi U, La U Prima, Cr 7, Cr 8, La Normal, La T, Red de Inyección 2, Palenque, Pablo VI, Pablo VI (Macromedidor), San Vicente, Cabí, Valencia, San Martin Parte Baja y Playita.",
    "Nom Responsable": "Angélica Ibargüen",
    "Fecha y hora esperada": "08/03/2022",
    "Inicio": "2022-03-08T11:00:00",
    "Fin": "2022-03-08T11:30:00",
    "Horas": "0,0208333333",
    "Estado": "CERRADA",
    "Fecha Registro": "04/03/2022",
    "Explicación": "bajo nivel en el tanque de suministro de la PTAP loma por inestabilidad en los caudales desde la fuente de captacion.",
    "Barrio": "Niño Jesus",
    "Nom Contratista": "Aguas Nacionales EPM S.A. E.S.P. \"Proyecto Aguas del Atrato\"\nGestiones integrales de occidente S.A.S. E.S.P.",
    "Tipo aviso": "Comunicado",
    "latitud": 5.713307,
    "longitud": -76.681735
  },
  {
    "Impacto": "Medio",
    "Circuito": "Niño Jesus",
    "Servicio": "Agua",
    "Motivo": "instalacion de bomba No 3 de sistema de bombeo bocatoma - loma",
    "Solicita": "ley 1712 del 6 de marzo de 2014 Ley de Transparencia y del Derecho de Acceso a la Información Pública",
    "N. Inst": 2.32,
    "Municipio": "Quibdó",
    "Dirección": "Niño Jesús Calle Real, Balcones, Media Luna, Almendros, La Unión, Red de Inyección 1, La Semi U, La U Prima, Cr 7, Cr 8, La Normal, La T, Red de Inyección 2, Palenque, Pablo VI, Pablo VI (Macromedidor), San Vicente, Cabí, Valencia, San Martin Parte Baja y Playita.",
    "Nom Responsable": "Angélica Ibargüen",
    "Fecha y hora esperada": "10/03/2022",
    "Inicio": "2022-03-10T07:00:00",
    "Fin": "2022-03-10T10:45:00",
    "Horas": "0,15625",
    "Estado": "CERRADA",
    "Fecha Registro": "10/03/2022",
    "Explicación": "instalacion de bomba No 3 de sistema de bombeo bocatoma - loma",
    "Barrio": "Niño Jesus",
    "Nom Contratista": "Aguas Nacionales EPM S.A. E.S.P. \"Proyecto Aguas del Atrato\"\nGestiones integrales de occidente S.A.S. E.S.P.",
    "Tipo aviso": "Comunicado",
    "latitud": 5.684106,
    "longitud": -76.622166
  },
  {
    "Impacto": "Medio",
    "Circuito": "Niño Jesus",
    "Servicio": "Agua",
    "Motivo": "realizacion de pruebas de medicion de caudal de impulsion de las bombas de impulsion sistema playita - loma",
    "Solicita": "ley 1712 del 6 de marzo de 2014 Ley de Transparencia y del Derecho de Acceso a la Información Pública",
    "N. Inst": 2.32,
    "Municipio": "Quibdó",
    "Dirección": "Niño Jesús Calle Real, Balcones, Media Luna, Almendros, La Unión, Red de Inyección 1, La Semi U, La U Prima, Cr 7, Cr 8, La Normal, La T, Red de Inyección 2, Palenque, Pablo VI, Pablo VI (Macromedidor), San Vicente, Cabí, Valencia, San Martin Parte Baja y Playita.",
    "Nom Responsable": "Angélica Ibargüen",
    "Fecha y hora esperada": "15/03/2022",
    "Inicio": "2022-03-15T09:00:00",
    "Fin": "2022-03-15T09:30:00",
    "Horas": "0,0208333333",
    "Estado": "CERRADA",
    "Fecha Registro": "15/03/2022",
    "Explicación": "realizacion de pruebas de medicion de caudal de impulsion de las bombas de impulsion sistema playita - loma",
    "Barrio": "Niño Jesus",
    "Nom Contratista": "Aguas Nacionales EPM S.A. E.S.P. \"Proyecto Aguas del Atrato\"\nGestiones integrales de occidente S.A.S. E.S.P.",
    "Tipo aviso": "Comunicado",
    "latitud": 5.702867,
    "longitud": -76.652503
  },
  {
    "Impacto": "Medio",
    "Circuito": "Niño Jesus",
    "Servicio": "Agua",
    "Motivo": "bajo nivel en el tanque de suministro de la PTAP loma por inestabilidad en los caudales desde la fuente de captacion.",
    "Solicita": "ley 1712 del 6 de marzo de 2014 Ley de Transparencia y del Derecho de Acceso a la Información Pública",
    "N. Inst": 2.32,
    "Municipio": "Quibdó",
    "Dirección": "Niño Jesús Calle Real, Balcones, Media Luna, Almendros, La Unión, Red de Inyección 1, La Semi U, La U Prima, Cr 7, Cr 8, La Normal, La T, Red de Inyección 2, Palenque, Pablo VI, Pablo VI (Macromedidor), San Vicente, Cabí, Valencia, San Martin Parte Baja y Playita.",
    "Nom Responsable": "Angélica Ibargüen",
    "Fecha y hora esperada": "17/03/2022",
    "Inicio": "2022-03-17T09:30:00",
    "Fin": "2022-03-17T23:00:00",
    "Horas": "0,0625",
    "Estado": "CERRADA",
    "Fecha Registro": "17/03/2022",
    "Explicación": "bajo nivel en el tanque de suministro de la PTAP loma por inestabilidad en los caudales desde la fuente de captacion.",
    "Barrio": "Niño Jesus",
    "Nom Contratista": "Aguas Nacionales EPM S.A. E.S.P. \"Proyecto Aguas del Atrato\"\nGestiones integrales de occidente S.A.S. E.S.P.",
    "Tipo aviso": "Comunicado",
    "latitud": 5.674148,
    "longitud": -76.700293
  },
  {
    "Impacto": "Medio",
    "Circuito": "Niño Jesus",
    "Servicio": "Agua",
    "Motivo": "bajo nivel en el tanque de suministro de la PTAP loma por inestabilidad en los caudales desde la fuente de captacion.",
    "Solicita": "ley 1712 del 6 de marzo de 2014 Ley de Transparencia y del Derecho de Acceso a la Información Pública",
    "N. Inst": 2.32,
    "Municipio": "Quibdó",
    "Dirección": "Niño Jesús Calle Real, Balcones, Media Luna, Almendros, La Unión, Red de Inyección 1, La Semi U, La U Prima, Cr 7, Cr 8, La Normal, La T, Red de Inyección 2, Palenque, Pablo VI, Pablo VI (Macromedidor), San Vicente, Cabí, Valencia, San Martin Parte Baja y Playita.",
    "Nom Responsable": "Angélica Ibargüen",
    "Fecha y hora esperada": "22/03/2022",
    "Inicio": "2022-03-22T02:30:00",
    "Fin": "2022-03-22T06:30:00",
    "Horas": "0,1666666667",
    "Estado": "CERRADA",
    "Fecha Registro": "22/03/2022",
    "Explicación": "bajo nivel en el tanque de suministro de la PTAP loma por inestabilidad en los caudales desde la fuente de captacion.",
    "Barrio": "Niño Jesus",
    "Nom Contratista": "Aguas Nacionales EPM S.A. E.S.P. \"Proyecto Aguas del Atrato\"\nGestiones integrales de occidente S.A.S. E.S.P.",
    "Tipo aviso": "Comunicado",
    "latitud": 5.668605,
    "longitud": -76.697047
  },
  {
    "Impacto": "Medio",
    "Circuito": "Niño Jesus",
    "Servicio": "Agua",
    "Motivo": "bajo nivel en el tanque de suministro de la PTAP loma por dreando para limpiezas de los sedimentadores.",
    "Solicita": "ley 1712 del 6 de marzo de 2014 Ley de Transparencia y del Derecho de Acceso a la Información Pública",
    "N. Inst": 2.32,
    "Municipio": "Quibdó",
    "Dirección": "Niño Jesús Calle Real, Balcones, Media Luna, Almendros, La Unión, Red de Inyección 1, La Semi U, La U Prima, Cr 7, Cr 8, La Normal, La T, Red de Inyección 2, Palenque, Pablo VI, Pablo VI (Macromedidor), San Vicente, Cabí, Valencia, San Martin Parte Baja y Playita.",
    "Nom Responsable": "Angélica Ibargüen",
    "Fecha y hora esperada": "26/03/2022",
    "Inicio": "2022-03-26T17:00:00",
    "Fin": "2022-03-26T20:45:00",
    "Horas": "0,15625",
    "Estado": "CERRADA",
    "Fecha Registro": "26/03/2022",
    "Explicación": "bajo nivel en el tanque de suministro de la PTAP loma por dreando para limpiezas de los sedimentadores.",
    "Barrio": "Niño Jesus",
    "Nom Contratista": "Aguas Nacionales EPM S.A. E.S.P. \"Proyecto Aguas del Atrato\"\nGestiones integrales de occidente S.A.S. E.S.P.",
    "Tipo aviso": "Comunicado",
    "latitud": 5.673255,
    "longitud": -76.632689
  },
  {
    "Impacto": "Medio",
    "Circuito": "Niño Jesus",
    "Servicio": "Agua",
    "Motivo": "suspension del fluido eletrico por parte de la empresa DISPAC",
    "Solicita": "ley 1712 del 6 de marzo de 2014 Ley de Transparencia y del Derecho de Acceso a la Información Pública",
    "N. Inst": 2.32,
    "Municipio": "Quibdó",
    "Dirección": "Niño Jesús Calle Real, Balcones, Media Luna, Almendros, La Unión, Red de Inyección 1, La Semi U, La U Prima, Cr 7, Cr 8, La Normal, La T, Red de Inyección 2, Palenque, Pablo VI, Pablo VI (Macromedidor), San Vicente, Cabí, Valencia, San Martin Parte Baja y Playita.",
    "Nom Responsable": "Angélica Ibargüen",
    "Fecha y hora esperada": "28/03/2022",
    "Inicio": "2022-03-28T09:00:00",
    "Fin": "2022-03-28T10:45:00",
    "Horas": "0,0520833333",
    "Estado": "CERRADA",
    "Fecha Registro": "19/03/2022",
    "Explicación": "realizacion de pruebas de medicion de caudal de impulsion de las bombas de impulsion sistema playita - loma",
    "Barrio": "Niño Jesus",
    "Nom Contratista": "Aguas Nacionales EPM S.A. E.S.P. \"Proyecto Aguas del Atrato\"\nGestiones integrales de occidente S.A.S. E.S.P.",
    "Tipo aviso": "Comunicado",
    "latitud": 5.703481,
    "longitud": -76.643386
  },
  {
    "Impacto": "Medio",
    "Circuito": "Niño Jesus",
    "Servicio": "Agua",
    "Motivo": "bajo nivel en el tanque de suministro de la PTAP loma por actividades de buceo en la captacion.",
    "Solicita": "ley 1712 del 6 de marzo de 2014 Ley de Transparencia y del Derecho de Acceso a la Información Pública",
    "N. Inst": 2.319,
    "Municipio": "Quibdó",
    "Dirección": "Niño Jesús Calle Real, Balcones, Media Luna, Almendros, La Unión, Red de Inyección 1, La Semi U, La U Prima, Cr 7, Cr 8, La Normal, La T, Red de Inyección 2, Palenque, Pablo VI, Pablo VI (Macromedidor), San Vicente, Cabí, Valencia, San Martin Parte Baja y Playita.",
    "Nom Responsable": "Angélica Ibargüen",
    "Fecha y hora esperada": "12/04/2022",
    "Inicio": "2022-04-12T11:00:00",
    "Fin": "2022-04-12T11:30:00",
    "Horas": "0,0625",
    "Estado": "CERRADA",
    "Fecha Registro": "12/04/2022",
    "Explicación": "bajo nivel en el tanque de suministro de la PTAP loma por actividades de buceo en la captacion.",
    "Barrio": "Niño Jesus",
    "Nom Contratista": "Aguas Nacionales EPM S.A. E.S.P. \"Proyecto Aguas del Atrato\"\nGestiones integrales de occidente S.A.S. E.S.P.",
    "Tipo aviso": "Comunicado",
    "latitud": 5.73931,
    "longitud": -76.653981
  },
  {
    "Impacto": "Medio",
    "Circuito": "Niño Jesus",
    "Servicio": "Agua",
    "Motivo": "suspension del fluido eletrico por parte de la empresa DISPAC",
    "Solicita": "ley 1712 del 6 de marzo de 2014 Ley de Transparencia y del Derecho de Acceso a la Información Pública",
    "N. Inst": 2.319,
    "Municipio": "Quibdó",
    "Dirección": "Niño Jesús Calle Real, Balcones, Media Luna, Almendros, La Unión, Red de Inyección 1, La Semi U, La U Prima, Cr 7, Cr 8, La Normal, La T, Red de Inyección 2, Palenque, Pablo VI, Pablo VI (Macromedidor), San Vicente, Cabí, Valencia, San Martin Parte Baja y Playita.",
    "Nom Responsable": "Angélica Ibargüen",
    "Fecha y hora esperada": "15/04/2022",
    "Inicio": "2022-04-15T13:00:00",
    "Fin": "2022-04-15T17:30:00",
    "Horas": "0,1875",
    "Estado": "CERRADA",
    "Fecha Registro": "15/04/2022",
    "Explicación": "suspension del fluido eletrico por parte de la empresa DISPAC",
    "Barrio": "Niño Jesus",
    "Nom Contratista": "Aguas Nacionales EPM S.A. E.S.P. \"Proyecto Aguas del Atrato\"\nGestiones integrales de occidente S.A.S. E.S.P.",
    "Tipo aviso": "Comunicado",
    "latitud": 5.67858,
    "longitud": -76.64169
  },
  {
    "Impacto": "Medio",
    "Circuito": "Niño Jesus",
    "Servicio": "Agua",
    "Motivo": "bajo nivel en el tanque de suministro de la PTAP loma por inestabilidad en los caudales desde la fuente de captacion.",
    "Solicita": "ley 1712 del 6 de marzo de 2014 Ley de Transparencia y del Derecho de Acceso a la Información Pública",
    "N. Inst": 2.319,
    "Municipio": "Quibdó",
    "Dirección": "Niño Jesús Calle Real, Balcones, Media Luna, Almendros, La Unión, Red de Inyección 1, La Semi U, La U Prima, Cr 7, Cr 8, La Normal, La T, Red de Inyección 2, Palenque, Pablo VI, Pablo VI (Macromedidor), San Vicente, Cabí, Valencia, San Martin Parte Baja y Playita.",
    "Nom Responsable": "Angélica Ibargüen",
    "Fecha y hora esperada": "16/04/2022",
    "Inicio": "2022-04-16T14:30:00",
    "Fin": "2022-04-16T18:00:00",
    "Horas": "0,1458333333",
    "Estado": "CERRADA",
    "Fecha Registro": "16/04/2022",
    "Explicación": "bajo nivel en el tanque de suministro de la PTAP loma por inestabilidad en los caudales desde la fuente de captacion.",
    "Barrio": "Niño Jesus",
    "Nom Contratista": "Aguas Nacionales EPM S.A. E.S.P. \"Proyecto Aguas del Atrato\"\nGestiones integrales de occidente S.A.S. E.S.P.",
    "Tipo aviso": "Comunicado",
    "latitud": 5.68789,
    "longitud": -76.655832
  },
  {
    "Impacto": "Medio",
    "Circuito": "Niño Jesus",
    "Servicio": "Agua",
    "Motivo": "suspension del fluido eletrico por parte de la empresa DISPAC",
    "Solicita": "ley 1712 del 6 de marzo de 2014 Ley de Transparencia y del Derecho de Acceso a la Información Pública",
    "N. Inst": 2.319,
    "Municipio": "Quibdó",
    "Dirección": "Niño Jesús Calle Real, Balcones, Media Luna, Almendros, La Unión, Red de Inyección 1, La Semi U, La U Prima, Cr 7, Cr 8, La Normal, La T, Red de Inyección 2, Palenque, Pablo VI, Pablo VI (Macromedidor), San Vicente, Cabí, Valencia, San Martin Parte Baja y Playita.",
    "Nom Responsable": "Anny Milena  Lozano",
    "Fecha y hora esperada": "25/04/2022",
    "Inicio": "2022-04-25T04:00:00",
    "Fin": "2022-04-25T08:45:00",
    "Horas": "0,1979166667",
    "Estado": "CERRADA",
    "Fecha Registro": "25/04/2022",
    "Explicación": "suspension del fluido eletrico por parte de la empresa DISPAC",
    "Barrio": "Niño Jesus",
    "Nom Contratista": "Aguas Nacionales EPM S.A. E.S.P. \"Proyecto Aguas del Atrato\"\nGestiones integrales de occidente S.A.S. E.S.P.",
    "Tipo aviso": "Comunicado",
    "latitud": 5.675392,
    "longitud": -76.647402
  },
  {
    "Impacto": "Medio",
    "Circuito": "Niño Jesus",
    "Servicio": "Agua",
    "Motivo": "bajo nivel en el tanque de suministro de la PTAP loma por drenado de tanque sedimentador.",
    "Solicita": "ley 1712 del 6 de marzo de 2014 Ley de Transparencia y del Derecho de Acceso a la Información Pública",
    "N. Inst": 2.319,
    "Municipio": "Quibdó",
    "Dirección": "Niño Jesús Calle Real, Balcones, Media Luna, Almendros, La Unión, Red de Inyección 1, La Semi U, La U Prima, Cr 7, Cr 8, La Normal, La T, Red de Inyección 2, Palenque, Pablo VI, Pablo VI (Macromedidor), San Vicente, Cabí, Valencia, San Martin Parte Baja y Playita.",
    "Nom Responsable": "Anny Milena  Lozano",
    "Fecha y hora esperada": "26/04/2022",
    "Inicio": "2022-04-26T13:00:00",
    "Fin": "2022-04-26T17:00:00",
    "Horas": "0,1666666667",
    "Estado": "CERRADA",
    "Fecha Registro": "26/04/2022",
    "Explicación": "bajo nivel en el tanque de suministro de la PTAP loma por drenado de tanque sedimentador.",
    "Barrio": "Niño Jesus",
    "Nom Contratista": "Aguas Nacionales EPM S.A. E.S.P. \"Proyecto Aguas del Atrato\"\nGestiones integrales de occidente S.A.S. E.S.P.",
    "Tipo aviso": "Comunicado",
    "latitud": 5.691782,
    "longitud": -76.663162
  },
  {
    "Impacto": "Medio",
    "Circuito": "Niño Jesus",
    "Servicio": "Agua",
    "Motivo": "suspensión de las plantas playita y loma por limpieza de regillas de las bomba de bocatoma",
    "Solicita": "ley 1712 del 6 de marzo de 2014 Ley de Transparencia y del Derecho de Acceso a la Información Pública",
    "N. Inst": 2.319,
    "Municipio": "Quibdó",
    "Dirección": "Niño Jesús Calle Real, Balcones, Media Luna, Almendros, La Unión, Red de Inyección 1, La Semi U, La U Prima, Cr 7, Cr 8, La Normal, La T, Red de Inyección 2, Palenque, Pablo VI, Pablo VI (Macromedidor), San Vicente, Cabí, Valencia, San Martin Parte Baja y Playita.",
    "Nom Responsable": "Anny Milena  Lozano",
    "Fecha y hora esperada": "03/05/2022",
    "Inicio": "2022-05-03T09:30:00",
    "Fin": "2022-05-03T13:30:00",
    "Horas": "0,2291666667",
    "Estado": "CERRADA",
    "Fecha Registro": "03/05/2022",
    "Explicación": "suspensión de las plantas playita y loma por limpieza de regillas de las bomba de bocatoma",
    "Barrio": "Niño Jesus",
    "Nom Contratista": "Aguas Nacionales EPM S.A. E.S.P. \"Proyecto Aguas del Atrato\"\nGestiones integrales de occidente S.A.S. E.S.P.",
    "Tipo aviso": "Comunicado",
    "latitud": 5.73596,
    "longitud": -76.691793
  },
  {
    "Impacto": "Medio",
    "Circuito": "Niño Jesus",
    "Servicio": "Agua",
    "Motivo": "suspension del fluido eletrico por parte de la empresa DISPAC",
    "Solicita": "ley 1712 del 6 de marzo de 2014 Ley de Transparencia y del Derecho de Acceso a la Información Pública",
    "N. Inst": 2.319,
    "Municipio": "Quibdó",
    "Dirección": "Niño Jesús Calle Real, Balcones, Media Luna, Almendros, La Unión, Red de Inyección 1, La Semi U, La U Prima, Cr 7, Cr 8, La Normal, La T, Red de Inyección 2, Palenque, Pablo VI, Pablo VI (Macromedidor), San Vicente, Cabí, Valencia, San Martin Parte Baja y Playita.",
    "Nom Responsable": "Willy Cordoba",
    "Fecha y hora esperada": "07/05/2022",
    "Inicio": "2022-05-07T08:00:00",
    "Fin": "2022-05-07T12:00:00",
    "Horas": "0,3333333333",
    "Estado": "CERRADA",
    "Fecha Registro": "07/05/2022",
    "Explicación": "suspension del fluido eletrico por parte de la empresa DISPAC",
    "Barrio": "Niño Jesus",
    "Nom Contratista": "Aguas Nacionales EPM S.A. E.S.P. \"Proyecto Aguas del Atrato\"\nGestiones integrales de occidente S.A.S. E.S.P.",
    "Tipo aviso": "Comunicado",
    "latitud": 5.693779,
    "longitud": -76.637978
  },
  {
    "Impacto": "Medio",
    "Circuito": "Niño Jesus",
    "Servicio": "Agua",
    "Motivo": "suspensión de las plantas playita y loma por limpieza de regillas de las bomba de bocatoma",
    "Solicita": "ley 1712 del 6 de marzo de 2014 Ley de Transparencia y del Derecho de Acceso a la Información Pública",
    "N. Inst": 2.319,
    "Municipio": "Quibdó",
    "Dirección": "Niño Jesús Calle Real, Balcones, Media Luna, Almendros, La Unión, Red de Inyección 1, La Semi U, La U Prima, Cr 7, Cr 8, La Normal, La T, Red de Inyección 2, Palenque, Pablo VI, Pablo VI (Macromedidor), San Vicente, Cabí, Valencia, San Martin Parte Baja y Playita.",
    "Nom Responsable": "Willy Cordoba",
    "Fecha y hora esperada": "10/05/2022",
    "Inicio": "2022-05-10T10:15:00",
    "Fin": "2022-05-10T12:00:00",
    "Horas": "0,2083333333",
    "Estado": "CERRADA",
    "Fecha Registro": "10/05/2022",
    "Explicación": "suspensión de las plantas playita y loma por limpieza de regillas de las bomba de bocatoma",
    "Barrio": "Niño Jesus",
    "Nom Contratista": "Aguas Nacionales EPM S.A. E.S.P. \"Proyecto Aguas del Atrato\"\nGestiones integrales de occidente S.A.S. E.S.P.",
    "Tipo aviso": "Comunicado",
    "latitud": 5.648858,
    "longitud": -76.629956
  },
  {
    "Impacto": "Medio",
    "Circuito": "Niño Jesus",
    "Servicio": "Agua",
    "Motivo": "suspension del fluido eletrico por parte de la empresa DISPAC",
    "Solicita": "ley 1712 del 6 de marzo de 2014 Ley de Transparencia y del Derecho de Acceso a la Información Pública",
    "N. Inst": 2.319,
    "Municipio": "Quibdó",
    "Dirección": "Niño Jesús Calle Real, Balcones, Media Luna, Almendros, La Unión, Red de Inyección 1, La Semi U, La U Prima, Cr 7, Cr 8, La Normal, La T, Red de Inyección 2, Palenque, Pablo VI, Pablo VI (Macromedidor), San Vicente, Cabí, Valencia, San Martin Parte Baja y Playita.",
    "Nom Responsable": "Willy Cordoba",
    "Fecha y hora esperada": "11/05/2022",
    "Inicio": "2022-05-11T08:45:00",
    "Fin": "2022-05-11T16:15:00",
    "Horas": "0,3506944444",
    "Estado": "CERRADA",
    "Fecha Registro": "11/05/2022",
    "Explicación": "suspension del fluido eletrico por parte de la empresa DISPAC",
    "Barrio": "Niño Jesus",
    "Nom Contratista": "Aguas Nacionales EPM S.A. E.S.P. \"Proyecto Aguas del Atrato\"\nGestiones integrales de occidente S.A.S. E.S.P.",
    "Tipo aviso": "Comunicado",
    "latitud": 5.738371,
    "longitud": -76.667524
  },
  {
    "Impacto": "Medio",
    "Circuito": "Niño Jesus",
    "Servicio": "Agua",
    "Motivo": "suspension del fluido eletrico por parte de la empresa DISPAC",
    "Solicita": "ley 1712 del 6 de marzo de 2014 Ley de Transparencia y del Derecho de Acceso a la Información Pública",
    "N. Inst": 2.319,
    "Municipio": "Quibdó",
    "Dirección": "Niño Jesús Calle Real, Balcones, Media Luna, Almendros, La Unión, Red de Inyección 1, La Semi U, La U Prima, Cr 7, Cr 8, La Normal, La T, Red de Inyección 2, Palenque, Pablo VI, Pablo VI (Macromedidor), San Vicente, Cabí, Valencia, San Martin Parte Baja y Playita.",
    "Nom Responsable": "Willy Cordoba",
    "Fecha y hora esperada": "12/05/2022",
    "Inicio": "2022-05-12T09:15:00",
    "Fin": "2022-05-12T10:15:00",
    "Horas": "0,0416666667",
    "Estado": "CERRADA",
    "Fecha Registro": "12/05/2022",
    "Explicación": "suspension del fluido eletrico por parte de la empresa DISPAC",
    "Barrio": "Niño Jesus",
    "Nom Contratista": "Aguas Nacionales EPM S.A. E.S.P. \"Proyecto Aguas del Atrato\"\nGestiones integrales de occidente S.A.S. E.S.P.",
    "Tipo aviso": "Comunicado",
    "latitud": 5.644285,
    "longitud": -76.636897
  },
  {
    "Impacto": "Medio",
    "Circuito": "Niño Jesus",
    "Servicio": "Agua",
    "Motivo": "suspension del fluido eletrico por parte de la empresa DISPAC",
    "Solicita": "ley 1712 del 6 de marzo de 2014 Ley de Transparencia y del Derecho de Acceso a la Información Pública",
    "N. Inst": 2.319,
    "Municipio": "Quibdó",
    "Dirección": "Niño Jesús Calle Real, Balcones, Media Luna, Almendros, La Unión, Red de Inyección 1, La Semi U, La U Prima, Cr 7, Cr 8, La Normal, La T, Red de Inyección 2, Palenque, Pablo VI, Pablo VI (Macromedidor), San Vicente, Cabí, Valencia, San Martin Parte Baja y Playita.",
    "Nom Responsable": "Willy Cordoba",
    "Fecha y hora esperada": "15/05/2022",
    "Inicio": "2022-05-15T08:30:00",
    "Fin": "2022-05-15T19:15:00",
    "Horas": "0,4201388889",
    "Estado": "CERRADA",
    "Fecha Registro": "15/05/2022",
    "Explicación": "suspension del fluido eletrico por parte de la empresa DISPAC",
    "Barrio": "Niño Jesus",
    "Nom Contratista": "Aguas Nacionales EPM S.A. E.S.P. \"Proyecto Aguas del Atrato\"\nGestiones integrales de occidente S.A.S. E.S.P.",
    "Tipo aviso": "Comunicado",
    "latitud": 5.703817,
    "longitud": -76.669746
  },
  {
    "Impacto": "Medio",
    "Circuito": "Niño Jesus",
    "Servicio": "Agua",
    "Motivo": "suspension del fluido eletrico por parte de la empresa DISPAC",
    "Solicita": "ley 1712 del 6 de marzo de 2014 Ley de Transparencia y del Derecho de Acceso a la Información Pública",
    "N. Inst": 2.319,
    "Municipio": "Quibdó",
    "Dirección": "Niño Jesús Calle Real, Balcones, Media Luna, Almendros, La Unión, Red de Inyección 1, La Semi U, La U Prima, Cr 7, Cr 8, La Normal, La T, Red de Inyección 2, Palenque, Pablo VI, Pablo VI (Macromedidor), San Vicente, Cabí, Valencia, San Martin Parte Baja y Playita.",
    "Nom Responsable": "Willy Cordoba",
    "Fecha y hora esperada": "17/05/2022",
    "Inicio": "2022-05-17T16:15:00",
    "Fin": "2022-05-17T17:15:00",
    "Horas": "0,03125",
    "Estado": "CERRADA",
    "Fecha Registro": "17/05/2022",
    "Explicación": "suspension del fluido eletrico por parte de la empresa DISPAC",
    "Barrio": "Niño Jesus",
    "Nom Contratista": "Aguas Nacionales EPM S.A. E.S.P. \"Proyecto Aguas del Atrato\"\nGestiones integrales de occidente S.A.S. E.S.P.",
    "Tipo aviso": "Comunicado",
    "latitud": 5.649563,
    "longitud": -76.665752
  },
  {
    "Impacto": "Medio",
    "Circuito": "Niño Jesus",
    "Servicio": "Agua",
    "Motivo": "suspension del fluido eletrico por parte de la empresa DISPAC",
    "Solicita": "ley 1712 del 6 de marzo de 2014 Ley de Transparencia y del Derecho de Acceso a la Información Pública",
    "N. Inst": 2.319,
    "Municipio": "Quibdó",
    "Dirección": "Niño Jesús Calle Real, Balcones, Media Luna, Almendros, La Unión, Red de Inyección 1, La Semi U, La U Prima, Cr 7, Cr 8, La Normal, La T, Red de Inyección 2, Palenque, Pablo VI, Pablo VI (Macromedidor), San Vicente, Cabí, Valencia, San Martin Parte Baja y Playita.",
    "Nom Responsable": "Willy Cordoba",
    "Fecha y hora esperada": "19/05/2022",
    "Inicio": "2022-05-19T09:00:00",
    "Fin": "2022-05-19T21:30:00",
    "Horas": "0,625",
    "Estado": "CERRADA",
    "Fecha Registro": "19/05/2022",
    "Explicación": "suspension del fluido eletrico por parte de la empresa DISPAC",
    "Barrio": "Niño Jesus",
    "Nom Contratista": "Aguas Nacionales EPM S.A. E.S.P. \"Proyecto Aguas del Atrato\"\nGestiones integrales de occidente S.A.S. E.S.P.",
    "Tipo aviso": "Comunicado",
    "latitud": 5.716385,
    "longitud": -76.678952
  },
  {
    "Impacto": "Medio",
    "Circuito": "Niño Jesus",
    "Servicio": "Agua",
    "Motivo": "suspension del fluido eletrico por parte de la empresa DISPAC",
    "Solicita": "ley 1712 del 6 de marzo de 2014 Ley de Transparencia y del Derecho de Acceso a la Información Pública",
    "N. Inst": 2.32,
    "Municipio": "Quibdó",
    "Dirección": "Niño Jesús Calle Real, Balcones, Media Luna, Almendros, La Unión, Red de Inyección 1, La Semi U, La U Prima, Cr 7, Cr 8, La Normal, La T, Red de Inyección 2, Palenque, Pablo VI, Pablo VI (Macromedidor), San Vicente, Cabí, Valencia, San Martin Parte Baja y Playita.",
    "Nom Responsable": "Willy Cordoba",
    "Fecha y hora esperada": "20/05/2022",
    "Inicio": "2022-05-20T06:00:00",
    "Fin": "2022-05-20T12:00:00",
    "Horas": "0,5",
    "Estado": "CERRADA",
    "Fecha Registro": "20/05/2022",
    "Explicación": "suspension del fluido eletrico por parte de la empresa DISPAC",
    "Barrio": "Niño Jesus",
    "Nom Contratista": "Aguas Nacionales EPM S.A. E.S.P. \"Proyecto Aguas del Atrato\"\nGestiones integrales de occidente S.A.S. E.S.P.",
    "Tipo aviso": "Comunicado",
    "latitud": 5.693134,
    "longitud": -76.65983
  },
  {
    "Impacto": "Medio",
    "Circuito": "Niño Jesus",
    "Servicio": "Agua",
    "Motivo": "suspensión de las plantas playita y loma por limpieza de regillas de las bomba de bocatoma",
    "Solicita": "ley 1712 del 6 de marzo de 2014 Ley de Transparencia y del Derecho de Acceso a la Información Pública",
    "N. Inst": 2.32,
    "Municipio": "Quibdó",
    "Dirección": "Niño Jesús Calle Real, Balcones, Media Luna, Almendros, La Unión, Red de Inyección 1, La Semi U, La U Prima, Cr 7, Cr 8, La Normal, La T, Red de Inyección 2, Palenque, Pablo VI, Pablo VI (Macromedidor), San Vicente, Cabí, Valencia, San Martin Parte Baja y Playita.",
    "Nom Responsable": "Willy Cordoba",
    "Fecha y hora esperada": "21/05/2022",
    "Inicio": "2022-05-21T09:15:00",
    "Fin": "2022-05-24T15:00:00",
    "Horas": "0,1770833333",
    "Estado": "CERRADA",
    "Fecha Registro": "24/05/2022",
    "Explicación": "suspensión de las plantas playita y loma por limpieza de regillas de las bomba de bocatoma",
    "Barrio": "Niño Jesus",
    "Nom Contratista": "Aguas Nacionales EPM S.A. E.S.P. \"Proyecto Aguas del Atrato\"\nGestiones integrales de occidente S.A.S. E.S.P.",
    "Tipo aviso": "Comunicado",
    "latitud": 5.709337,
    "longitud": -76.685114
  },
  {
    "Impacto": "Medio",
    "Circuito": "Niño Jesus",
    "Servicio": "Agua",
    "Motivo": "suspensión de las plantas playita y loma por limpieza de regillas de las bomba de bocatoma",
    "Solicita": "ley 1712 del 6 de marzo de 2014 Ley de Transparencia y del Derecho de Acceso a la Información Pública",
    "N. Inst": 2.32,
    "Municipio": "Quibdó",
    "Dirección": "Niño Jesús Calle Real, Balcones, Media Luna, Almendros, La Unión, Red de Inyección 1, La Semi U, La U Prima, Cr 7, Cr 8, La Normal, La T, Red de Inyección 2, Palenque, Pablo VI, Pablo VI (Macromedidor), San Vicente, Cabí, Valencia, San Martin Parte Baja y Playita.",
    "Nom Responsable": "Willy Cordoba",
    "Fecha y hora esperada": "31/05/2022",
    "Inicio": "2022-05-31T09:45:00",
    "Fin": "2022-05-31T15:30:00",
    "Horas": "0,125",
    "Estado": "CERRADA",
    "Fecha Registro": "31/05/2022",
    "Explicación": "suspensión de las plantas playita y loma por limpieza de regillas de las bomba de bocatoma",
    "Barrio": "Niño Jesus",
    "Nom Contratista": "Aguas Nacionales EPM S.A. E.S.P. \"Proyecto Aguas del Atrato\"\nGestiones integrales de occidente S.A.S. E.S.P.",
    "Tipo aviso": "Comunicado",
    "latitud": 5.695518,
    "longitud": -76.610592
  },
  {
    "Impacto": "Medio",
    "Circuito": "Niño Jesus",
    "Servicio": "Agua",
    "Motivo": "suspension del fluido eletrico por parte de la empresa DISPAC",
    "Solicita": "ley 1712 del 6 de marzo de 2014 Ley de Transparencia y del Derecho de Acceso a la Información Pública",
    "N. Inst": 2.32,
    "Municipio": "Quibdó",
    "Dirección": "Niño Jesús Calle Real, Balcones, Media Luna, Almendros, La Unión, Red de Inyección 1, La Semi U, La U Prima, Cr 7, Cr 8, La Normal, La T, Red de Inyección 2, Palenque, Pablo VI, Pablo VI (Macromedidor), San Vicente, Cabí, Valencia, San Martin Parte Baja y Playita.",
    "Nom Responsable": "Willy Cordoba",
    "Fecha y hora esperada": "15/06/2022",
    "Inicio": "2022-06-15T06:00:00",
    "Fin": "2022-06-15T18:30:00",
    "Horas": "0,5625",
    "Estado": "CERRADA",
    "Fecha Registro": "15/06/2022",
    "Explicación": "suspension del fluido eletrico por parte de la empresa DISPAC",
    "Barrio": "Niño Jesus",
    "Nom Contratista": "Aguas Nacionales EPM S.A. E.S.P. \"Proyecto Aguas del Atrato\"\nGestiones integrales de occidente S.A.S. E.S.P.",
    "Tipo aviso": "Comunicado",
    "latitud": 5.682886,
    "longitud": -76.670458
  },
  {
    "Impacto": "Medio",
    "Circuito": "Niño Jesus",
    "Servicio": "Agua",
    "Motivo": "suspension del fluido eletrico por parte de la empresa DISPAC",
    "Solicita": "ley 1712 del 6 de marzo de 2014 Ley de Transparencia y del Derecho de Acceso a la Información Pública",
    "N. Inst": 2.32,
    "Municipio": "Quibdó",
    "Dirección": "Niño Jesús Calle Real, Balcones, Media Luna, Almendros, La Unión, Red de Inyección 1, La Semi U, La U Prima, Cr 7, Cr 8, La Normal, La T, Red de Inyección 2, Palenque, Pablo VI, Pablo VI (Macromedidor), San Vicente, Cabí, Valencia, San Martin Parte Baja y Playita.",
    "Nom Responsable": "Willy Cordoba",
    "Fecha y hora esperada": "16/06/2022",
    "Inicio": "2022-06-16T08:30:00",
    "Fin": "2022-06-16T15:45:00",
    "Horas": "0,2291666667",
    "Estado": "CERRADA",
    "Fecha Registro": "16/06/2022",
    "Explicación": "suspension del fluido eletrico por parte de la empresa DISPAC",
    "Barrio": "Niño Jesus",
    "Nom Contratista": "Aguas Nacionales EPM S.A. E.S.P. \"Proyecto Aguas del Atrato\"\nGestiones integrales de occidente S.A.S. E.S.P.",
    "Tipo aviso": "Comunicado",
    "latitud": 5.642236,
    "longitud": -76.61562
  },
  {
    "Impacto": "Medio",
    "Circuito": "Niño Jesus",
    "Servicio": "Agua",
    "Motivo": "suspensión de las plantas playita y loma por limpieza de regillas de las bomba de bocatoma",
    "Solicita": "ley 1712 del 6 de marzo de 2014 Ley de Transparencia y del Derecho de Acceso a la Información Pública",
    "N. Inst": 2.32,
    "Municipio": "Quibdó",
    "Dirección": "Niño Jesús Calle Real, Balcones, Media Luna, Almendros, La Unión, Red de Inyección 1, La Semi U, La U Prima, Cr 7, Cr 8, La Normal, La T, Red de Inyección 2, Palenque, Pablo VI, Pablo VI (Macromedidor), San Vicente, Cabí, Valencia, San Martin Parte Baja y Playita.",
    "Nom Responsable": "Willy Cordoba",
    "Fecha y hora esperada": "21/06/2022",
    "Inicio": "2022-06-21T14:30:00",
    "Fin": "2022-06-21T15:30:00",
    "Horas": "0,0416666667",
    "Estado": "CERRADA",
    "Fecha Registro": "21/06/2022",
    "Explicación": "suspensión de las plantas playita y loma por limpieza de regillas de las bomba de bocatoma",
    "Barrio": "Niño Jesus",
    "Nom Contratista": "Aguas Nacionales EPM S.A. E.S.P. \"Proyecto Aguas del Atrato\"\nGestiones integrales de occidente S.A.S. E.S.P.",
    "Tipo aviso": "Comunicado",
    "latitud": 5.699833,
    "longitud": -76.618683
  },
  {
    "Impacto": "Medio",
    "Circuito": "Niño Jesus",
    "Servicio": "Agua",
    "Motivo": "suspension del fluido eletrico por parte de la empresa DISPAC",
    "Solicita": "ley 1712 del 6 de marzo de 2014 Ley de Transparencia y del Derecho de Acceso a la Información Pública",
    "N. Inst": 2.32,
    "Municipio": "Quibdó",
    "Dirección": "Niño Jesús Calle Real, Balcones, Media Luna, Almendros, La Unión, Red de Inyección 1, La Semi U, La U Prima, Cr 7, Cr 8, La Normal, La T, Red de Inyección 2, Palenque, Pablo VI, Pablo VI (Macromedidor), San Vicente, Cabí, Valencia, San Martin Parte Baja y Playita.",
    "Nom Responsable": "Willy Cordoba",
    "Fecha y hora esperada": "22/06/2022",
    "Inicio": "2022-06-22T08:30:00",
    "Fin": "2022-06-22T18:30:00",
    "Horas": "0,4166666667",
    "Estado": "CERRADA",
    "Fecha Registro": "22/06/2022",
    "Explicación": "suspension del fluido eletrico por parte de la empresa DISPAC",
    "Barrio": "Niño Jesus",
    "Nom Contratista": "Aguas Nacionales EPM S.A. E.S.P. \"Proyecto Aguas del Atrato\"\nGestiones integrales de occidente S.A.S. E.S.P.",
    "Tipo aviso": "Comunicado",
    "latitud": 5.678699,
    "longitud": -76.656274
  },
  {
    "Impacto": "Medio",
    "Circuito": "Ciudadela MIA",
    "Servicio": "Agua",
    "Motivo": "instalacion de macromedidor en la linea de impulsion de agua potable",
    "Solicita": "ley 1712 del 6 de marzo de 2014 Ley de Transparencia y del Derecho de Acceso a la Información Pública",
    "N. Inst": 1.508,
    "Municipio": "Quibdó",
    "Dirección": "sectro A, sector B, sector C, sector D, sector E",
    "Nom Responsable": "Willy Cordoba",
    "Fecha y hora esperada": "23/06/2022",
    "Inicio": "2022-06-23T22:00:00",
    "Fin": "2022-06-23T23:59:00",
    "Horas": "0,0833333333",
    "Estado": "CERRADA",
    "Fecha Registro": "23/06/2022",
    "Explicación": "instalacion de macromedidor en la linea de impulsion de agua potable",
    "Barrio": "Ciudadela MIA (Sectores A, B, C, D y E)",
    "Nom Contratista": "Aguas Nacionales EPM S.A. E.S.P. \"Proyecto Aguas del Atrato\"\nGestiones integrales de occidente S.A.S. E.S.P.",
    "Tipo aviso": "Comunicado",
    "latitud": 5.687493,
    "longitud": -76.621886
  },
  {
    "Impacto": "Medio",
    "Circuito": "Ciudadela MIA",
    "Servicio": "Agua",
    "Motivo": "instalacion de macromedidor en la linea de impulsion de agua potable",
    "Solicita": "ley 1712 del 6 de marzo de 2014 Ley de Transparencia y del Derecho de Acceso a la Información Pública",
    "N. Inst": 1.508,
    "Municipio": "Quibdó",
    "Dirección": "sectro A, sector B, sector C, sector D, sector E",
    "Nom Responsable": "Willy Cordoba",
    "Fecha y hora esperada": "24/06/2022",
    "Inicio": "2022-06-24T00:00:00",
    "Fin": "2022-06-24T11:45:00",
    "Horas": "0,4895833333",
    "Estado": "CERRADA",
    "Fecha Registro": "24/06/2022",
    "Explicación": "instalacion de macromedidor en la linea de impulsion de agua potable",
    "Barrio": "Ciudadela MIA (Sectores A, B, C, D y E)",
    "Nom Contratista": "Aguas Nacionales EPM S.A. E.S.P. \"Proyecto Aguas del Atrato\"\nGestiones integrales de occidente S.A.S. E.S.P.",
    "Tipo aviso": "Comunicado",
    "latitud": 5.707182,
    "longitud": -76.621542
  },
  {
    "Impacto": "Medio",
    "Circuito": "Niño Jesus",
    "Servicio": "Agua",
    "Motivo": "suspension del fluido eletrico por parte de la empresa DISPAC",
    "Solicita": "ley 1712 del 6 de marzo de 2014 Ley de Transparencia y del Derecho de Acceso a la Información Pública",
    "N. Inst": 2.32,
    "Municipio": "Quibdó",
    "Dirección": "Niño Jesús Calle Real, Balcones, Media Luna, Almendros, La Unión, Red de Inyección 1, La Semi U, La U Prima, Cr 7, Cr 8, La Normal, La T, Red de Inyección 2, Palenque, Pablo VI, Pablo VI (Macromedidor), San Vicente, Cabí, Valencia, San Martin Parte Baja y Playita.",
    "Nom Responsable": "Willy Cordoba",
    "Fecha y hora esperada": "29/06/2022",
    "Inicio": "2022-06-29T08:30:00",
    "Fin": "2022-06-29T14:30:00",
    "Horas": "0,125",
    "Estado": "CERRADA",
    "Fecha Registro": "29/06/2022",
    "Explicación": "suspension del fluido eletrico por parte de la empresa DISPAC",
    "Barrio": "Niño Jesus",
    "Nom Contratista": "Aguas Nacionales EPM S.A. E.S.P. \"Proyecto Aguas del Atrato\"\nGestiones integrales de occidente S.A.S. E.S.P.",
    "Tipo aviso": "Comunicado",
    "latitud": 5.676058,
    "longitud": -76.700347
  },
  {
    "Impacto": "Medio",
    "Circuito": "Niño Jesus",
    "Servicio": "Agua",
    "Motivo": "suspension del fluido eletrico por parte de la empresa DISPAC",
    "Solicita": "ley 1712 del 6 de marzo de 2014 Ley de Transparencia y del Derecho de Acceso a la Información Pública",
    "N. Inst": 2.32,
    "Municipio": "Quibdó",
    "Dirección": "Niño Jesús Calle Real, Balcones, Media Luna, Almendros, La Unión, Red de Inyección 1, La Semi U, La U Prima, Cr 7, Cr 8, La Normal, La T, Red de Inyección 2, Palenque, Pablo VI, Pablo VI (Macromedidor), San Vicente, Cabí, Valencia, San Martin Parte Baja y Playita.",
    "Nom Responsable": "Willy Cordoba",
    "Fecha y hora esperada": "01/07/2022",
    "Inicio": "2022-07-01T08:30:00",
    "Fin": "2022-07-01T18:30:00",
    "Horas": "0,40625",
    "Estado": "CERRADA",
    "Fecha Registro": "30/06/2022",
    "Explicación": "suspension del fluido eletrico por parte de la empresa DISPAC",
    "Barrio": "Niño Jesus",
    "Nom Contratista": "Aguas Nacionales EPM S.A. E.S.P. \"Proyecto Aguas del Atrato\"\nGestiones integrales de occidente S.A.S. E.S.P.",
    "Tipo aviso": "Comunicado",
    "latitud": 5.66468,
    "longitud": -76.636851
  },
  {
    "Impacto": "Medio",
    "Circuito": "Niño Jesus",
    "Servicio": "Agua",
    "Motivo": "suspensión de las plantas playita y loma por limpieza de regillas de las bomba de bocatoma",
    "Solicita": "ley 1712 del 6 de marzo de 2014 Ley de Transparencia y del Derecho de Acceso a la Información Pública",
    "N. Inst": 2.32,
    "Municipio": "Quibdó",
    "Dirección": "Niño Jesús Calle Real, Balcones, Media Luna, Almendros, La Unión, Red de Inyección 1, La Semi U, La U Prima, Cr 7, Cr 8, La Normal, La T, Red de Inyección 2, Palenque, Pablo VI, Pablo VI (Macromedidor), San Vicente, Cabí, Valencia, San Martin Parte Baja y Playita.",
    "Nom Responsable": "Willy Cordoba",
    "Fecha y hora esperada": "05/07/2022",
    "Inicio": "2022-07-05T13:30:00",
    "Fin": "2022-07-05T15:30:00",
    "Horas": "0,0833333333",
    "Estado": "CERRADA",
    "Fecha Registro": "05/07/2022",
    "Explicación": "suspensión de las plantas playita y loma por limpieza de regillas de las bomba de bocatoma",
    "Barrio": "Niño Jesus",
    "Nom Contratista": "Aguas Nacionales EPM S.A. E.S.P. \"Proyecto Aguas del Atrato\"\nGestiones integrales de occidente S.A.S. E.S.P.",
    "Tipo aviso": "Comunicado",
    "latitud": 5.658423,
    "longitud": -76.657164
  },
  {
    "Impacto": "Medio",
    "Circuito": "Zona Minera",
    "Servicio": "Agua",
    "Motivo": "Lavado del tanque semienterrado de almacenamiento de la planta Playita II por parte de personal contratista, para dar cumplimiento al decreto 1575 del 2007 artículo 8 y 9, “Por el cual se establece el Sistema para la Protección y Control de la Calidad del Agua para Consumo Humano”.",
    "Solicita": "ley 1712 del 6 de marzo de 2014 Ley de Transparencia y del Derecho de Acceso a la Información Pública",
    "N. Inst": 5.414,
    "Municipio": "Quibdó",
    "Dirección": "Poblado - Flores de Buenaños, Vía Cabí, Guaje, Montebello - Las Terrazas - San Francisco de Medrano, Medrano Alto (de la UTCH a la entrada de Viento Libre), Mercedes, Playita, Piñal, Viento Libre y Minuto de Dios parte baja.",
    "Nom Responsable": "Jeidy Yakelin González Mena",
    "Fecha y hora esperada": "13/01/2021",
    "Inicio": "2021-01-13T07:00:00",
    "Fin": "2021-01-13T12:00:00",
    "Horas": "0,208333333",
    "Estado": "ACTIVA",
    "Fecha Registro": "14/01/2021",
    "Explicación": "Se distribuye de una tanque elevado llamado ZONA MINERA independiente de 1000m3  y durante el desarrollo del lavado no se realizó bombeo a este tanque; por lo tanto, no se pudo dar suministro",
    "Barrio": "Poblado - Flores de Buenaños, Vía Cabí, Guaje, Montebello - Las Terrazas - San Francisco de Medrano, Medrano Alto (de la UTCH a la entrada de Viento Libre), Mercedes, Playita, Piñal, Viento Libre y Minuto de Dios parte baja.",
    "Nom Contratista": "Aguas Nacionales EPM S.A. E.S.P. \"Proyecto Aguas del Atrato\"\nGestiones integrales de occidente S.A.S. E.S.P.",
    "Tipo aviso": "Comunicado",
    "latitud": 5.662639,
    "longitud": -76.610461
  },
  {
    "Impacto": "Medio",
    "Circuito": "Institucional, Comercial y Séptima",
    "Servicio": "Agua",
    "Motivo": "Lavado del tanque semienterrado de almacenamiento de la planta Playita II por parte de personal contratista, para dar cumplimiento al decreto 1575 del 2007 artículo 8 y 9, “Por el cual se establece el Sistema para la Protección y Control de la Calidad del Agua para Consumo Humano”.",
    "Solicita": "ley 1712 del 6 de marzo de 2014 Ley de Transparencia y del Derecho de Acceso a la Información Pública",
    "N. Inst": 4.73,
    "Municipio": "Quibdó",
    "Dirección": "De la calle 35 a la calle 20 y de la Carrera 1 a la calle  10",
    "Nom Responsable": "Jeidy Yakelin González Mena",
    "Fecha y hora esperada": "14/01/2021",
    "Inicio": "2021-01-14T08:00:00",
    "Fin": "2021-01-14T10:00:00",
    "Horas": "0,083333333",
    "Estado": "ACTIVA",
    "Fecha Registro": "14/01/2021",
    "Explicación": "Se distribuye del tanque elevado de la Planta La Loma y durante el desarrollo del lavado no se realizó bombeo a este tanque desde Planta Playita, solo se bombeó desde Planta Loma; por lo tanto, no se pudo dar suministro permanente",
    "Barrio": "Yesquita, Roma, Miraflores, Roma, Yescagrande, Pan de Yuca, Cesar Conto, Tomas Pérez, Cristo Rey, Silencio, Kennedy, Chambacú, Chamblún, Alameda Reyes",
    "Nom Contratista": "Aguas Nacionales EPM S.A. E.S.P. \"Proyecto Aguas del Atrato\"\nGestiones integrales de occidente S.A.S. E.S.P.",
    "Tipo aviso": "Comunicado",
    "latitud": 5.70075,
    "longitud": -76.682727
  },
  {
    "Impacto": "Medio",
    "Circuito": "Institucional, Comercial y Séptima",
    "Servicio": "Agua",
    "Motivo": "Lavado del tanque semienterrado de almacenamiento de la planta Playita II por parte de personal contratista, para dar cumplimiento al decreto 1575 del 2007 artículo 8 y 9, “Por el cual se establece el Sistema para la Protección y Control de la Calidad del Agua para Consumo Humano”.",
    "Solicita": "ley 1712 del 6 de marzo de 2014 Ley de Transparencia y del Derecho de Acceso a la Información Pública",
    "N. Inst": 4.73,
    "Municipio": "Quibdó",
    "Dirección": "De la calle 35 a la calle 20 y de la Carrera 1 a la calle  10",
    "Nom Responsable": "Jeidy Yakelin González Mena",
    "Fecha y hora esperada": "14/01/2021",
    "Inicio": "2021-01-15T18:00:00",
    "Fin": "2021-01-15T22:00:00",
    "Horas": "0,166666667",
    "Estado": "ACTIVA",
    "Fecha Registro": "14/01/2021",
    "Explicación": "Se distribuye del tanque elevado de la Planta La Loma y durante el desarrollo del lavado no se realizó bombeo a este tanque desde Planta Playita, solo se bombeó desde Planta Loma; por lo tanto, no se pudo dar suministro permanente",
    "Barrio": "Yesquita, Roma, Miraflores, Roma, Yescagrande, Pan de Yuca, Cesar Conto, Tomas Pérez, Cristo Rey, Silencio, Kennedy, Chambacú, Chamblún, Alameda Reyes",
    "Nom Contratista": "Aguas Nacionales EPM S.A. E.S.P. \"Proyecto Aguas del Atrato\"\nGestiones integrales de occidente S.A.S. E.S.P.",
    "Tipo aviso": "Comunicado",
    "latitud": 5.682636,
    "longitud": -76.617294
  },
  {
    "Impacto": "Medio",
    "Circuito": "Margarita, Medrano Bajo y San Martin, Red Expresa",
    "Servicio": "Agua",
    "Motivo": "Lavado del tanque semienterrado de almacenamiento de la planta Playita II por parte de personal contratista, para dar cumplimiento al decreto 1575 del 2007 artículo 8 y 9, “Por el cual se establece el Sistema para la Protección y Control de la Calidad del Agua para Consumo Humano”.",
    "Solicita": "ley 1712 del 6 de marzo de 2014 Ley de Transparencia y del Derecho de Acceso a la Información Pública",
    "N. Inst": 1.257,
    "Municipio": "Quibdó",
    "Dirección": "Esmeralda,  Chirrarronal, Margarita principal, Cohimbra, San Judas, San Martin, Carrera 9 y Calle 30 hasta Comando Policía Quibdó",
    "Nom Responsable": "Jeidy Yakelin González Mena",
    "Fecha y hora esperada": "14/01/2021",
    "Inicio": "2021-01-14T14:00:00",
    "Fin": "2021-01-14T17:30:00",
    "Horas": "0,145833333",
    "Estado": "ACTIVA",
    "Fecha Registro": "14/01/2021",
    "Explicación": "Se distribuye del tanque elevado de la Planta La Loma y durante el desarrollo del lavado no se realizó bombeo a este tanque desde Planta Playita, solo se bombeó desde Planta Loma; por lo tanto, no se pudo dar suministro permanente",
    "Barrio": "Chicharronal, Margaritas, Esmeralda, Cohímbra, Medrano (Parte alta), San Martin (Parte alta), Carrera 9 y Calle 30 hasta Comando Policía Quibdó",
    "Nom Contratista": "Aguas Nacionales EPM S.A. E.S.P. \"Proyecto Aguas del Atrato\"\nGestiones integrales de occidente S.A.S. E.S.P.",
    "Tipo aviso": "Comunicado",
    "latitud": 5.676871,
    "longitud": -76.61929
  },
  {
    "Impacto": "Medio",
    "Circuito": "Ciudadela MIA",
    "Servicio": "Agua",
    "Motivo": "reubicacion de macromedidor electronico en la salida de las bombas de impulsion",
    "Solicita": "ley 1712 del 6 de marzo de 2014 Ley de Transparencia y del Derecho de Acceso a la Información Pública",
    "N. Inst": 1.508,
    "Municipio": "Quibdó",
    "Dirección": "sectro A, sector B, sector C, sector D, sector E",
    "Nom Responsable": "Willy Cordoba",
    "Fecha y hora esperada": "07/07/2022",
    "Inicio": "2022-07-07T09:00:00",
    "Fin": "2022-07-07T11:30:00",
    "Horas": "0,1041666667",
    "Estado": "CERRADA",
    "Fecha Registro": "07/07/2022",
    "Explicación": "reubicacion de macromedidor electronico en la salida de las bombas de impulsion",
    "Barrio": "Ciudadela MIA (Sectores A, B, C, D y E)",
    "Nom Contratista": "Aguas Nacionales EPM S.A. E.S.P. \"Proyecto Aguas del Atrato\"\nGestiones integrales de occidente S.A.S. E.S.P.",
    "Tipo aviso": "Comunicado",
    "latitud": 5.704879,
    "longitud": -76.686738
  },
  {
    "Impacto": "Medio",
    "Circuito": "Red Expresa",
    "Servicio": "Agua",
    "Motivo": "Bombeo Directo",
    "Solicita": "ley 1712 del 6 de marzo de 2014 Ley de Transparencia y del Derecho de Acceso a la Información Pública",
    "N. Inst": 235.0,
    "Municipio": "Quibdó",
    "Dirección": "De Cra 9 con calle 24 a Cra 9 con calle 24 y de Cra 9 con Calle 30 hasta Rotonda Comando Policia Municipio de Quibdó",
    "Nom Responsable": "Angelica Ibarguen",
    "Fecha y hora esperada": "29/07/2020",
    "Inicio": "2020-07-29T20:00:00",
    "Fin": "2020-12-31T22:00:00",
    "Horas": "2",
    "Estado": "ACTIVA",
    "Fecha Registro": "01/01/1995",
    "Explicación": "Se realiza Bombeo Directo desde Planta Playita debido que el proyecto fue concebido de esa forma, para que los usuarios tuvieran sus almacenamientos individuales.",
    "Barrio": "Chamblum, Julio Figuroa Villa solo Calle 30, Santa Ana Solo Calle.",
    "Nom Contratista": "Aguas Nacionales EPM S.A. E.S.P. \"Proyecto Aguas del Atrato\"",
    "Tipo aviso": "Normalizado",
    "latitud": 5.712792,
    "longitud": -76.696282
  },
  {
    "Impacto": "Bajo",
    "Circuito": "Centro, Institucional, Margarita, Medrano Bajo y San Martin.",
    "Servicio": "Agua",
    "Motivo": "Falta Almacenamiento Planta Loma y Optimización Planta Playita",
    "Solicita": "ley 1712 del 6 de marzo de 2014 Ley de Transparencia y del Derecho de Acceso a la Información Pública",
    "N. Inst": 6.19,
    "Municipio": "Quibdó",
    "Dirección": "De la calle 35 a la calle 20 y de la Carrera 1 a la calle  10 y Esmeralda,  Chirraronal, Margarita principal, Cohimbra, San Judas y San Martin.",
    "Nom Responsable": "Angelica Ibarguen",
    "Fecha y hora esperada": "29/07/2020",
    "Inicio": "2020-07-29T06:00:00",
    "Fin": "2020-12-31T22:00:00",
    "Horas": "8",
    "Estado": "ACTIVA",
    "Fecha Registro": "29/07/2020",
    "Explicación": "Se realiza suministro de 6:00 a 8:00; de 11:00 a 13:00; de 16:00 a 18:00 y de 20:00 a 22:00 la intermitencia se debe a la Falta de Almacenamiento en Planta Loma y  la Optimización de Planta Playita, actualmente se cuenta con un tanque elevado de 700m3",
    "Barrio": "La Paz, San Jose,Miraflores, Kennedy, Tomas Perez, Cristo Rey, Roma, Cesar Conto, Silencio, Margarita, Esmeralda, Alameda, Pan de Yuca, yesca grande, yesquita, San Martin,",
    "Nom Contratista": "Aguas Nacionales EPM S.A. E.S.P. \"Proyecto Aguas del Atrato\"",
    "Tipo aviso": "Comunicado",
    "latitud": 5.710993,
    "longitud": -76.678685
  },
  {
    "Impacto": "Bajo",
    "Circuito": "Zona Minera",
    "Servicio": "Agua",
    "Motivo": "Falta Almacenamiento Tanque Zona Norte y Optimización Planta Playita",
    "Solicita": "ley 1712 del 6 de marzo de 2014 Ley de Transparencia y del Derecho de Acceso a la Información Pública",
    "N. Inst": 3.38,
    "Municipio": "Quibdó",
    "Dirección": "Zona Minera, Suba I y II, Castillo I y II, Minercol, La Victoria, Jardin (Los Rosales, Las Dalias, Las Begonias, Las Palmeras, Jazmin, Orquidea, Violetas, Tulipanes, Heliconias, Turpiales), Condoto, Palacios, Angeles, Las Americas, Santa Ana, Margarita, El Bosque, Coliseo, Minuto de Dios parte Alta, Calle 18.",
    "Nom Responsable": "Wladimir Ledesma H.",
    "Fecha y hora esperada": "29/07/2020",
    "Inicio": "2020-07-29T06:00:00",
    "Fin": "2020-12-31T11:00:00",
    "Horas": "5",
    "Estado": "ACTIVA",
    "Fecha Registro": "29/07/2020",
    "Explicación": "Se distribuye de una tanque elevado llamado ZONA MINERA independiente de 1000m3",
    "Barrio": "Zona Minera, Suba I y II, Castillo I y II, Minercol, La Victoria, Jardin (Los Rosales, Las Dalias, Las Begonias, Las Palmeras, Jazmin, Orquidea, Violetas, Tulipanes, Heliconias, Turpiales), Condoto, Palacios, Angeles, Las Americas, Santa Ana, Margarita, El Bosque, Coliseo, Minuto de Dios parte Alta, Calle 18.",
    "Nom Contratista": "Aguas Nacionales EPM S.A. E.S.P. \"Proyecto Aguas del Atrato\"",
    "Tipo aviso": "Comunicado",
    "latitud": 5.666392,
    "longitud": -76.646015
  },
  {
    "Impacto": "Bajo",
    "Circuito": "Zona Minera",
    "Servicio": "Agua",
    "Motivo": "Falta Almacenamiento Tanque Zona Norte y Optimización Planta Playita",
    "Solicita": "ley 1712 del 6 de marzo de 2014 Ley de Transparencia y del Derecho de Acceso a la Información Pública",
    "N. Inst": 1.97,
    "Municipio": "Quibdó",
    "Dirección": "El Poblado, Flores de Buenaños, Via Cabi, El Guaje, Las Terrazas, San Francisco de Medrano, Medrano Alto ( de la U.T.CH. hasta la entrada de viento libre), Las Mercedes, La Playita, el Pinal de Medrano, Viento Libre y Minuto de Dios Parte Baja.",
    "Nom Responsable": "Wladimir Ledesma H.",
    "Fecha y hora esperada": "29/07/2020",
    "Inicio": "2020-07-29T18:00:00",
    "Fin": "2020-12-31T21:00:00",
    "Horas": "3",
    "Estado": "ACTIVA",
    "Fecha Registro": "29/07/2020",
    "Explicación": "Se distribuye de una tanque elevado llamado ZONA MINERA independiente de 1000m3",
    "Barrio": "El Poblado, Flores de Buenaños, Via Cabi, El Guaje, Las Terrazas, San Francisco de Medrano, Medrano Alto ( de la U.T.CH. hasta la entrada de viento libre), Las Mercedes, La Playita, el Pinal de Medrano, Viento Libre y Minuto de Dios Parte Baja.",
    "Nom Contratista": "Aguas Nacionales EPM S.A. E.S.P. \"Proyecto Aguas del Atrato\"",
    "Tipo aviso": "Comunicado",
    "latitud": 5.731178,
    "longitud": -76.622202
  },
  {
    "Impacto": "Bajo",
    "Circuito": "ZONA NORTE",
    "Servicio": "Agua",
    "Motivo": "Falta Almacenamiento Tanque Zona Norte y Optimización Planta Playita",
    "Solicita": "ley 1712 del 6 de marzo de 2014 Ley de Transparencia y del Derecho de Acceso a la Información Pública",
    "N. Inst": 3.69,
    "Municipio": "Quibdó",
    "Dirección": "Samper, La Victoria, Casa Blanca, Villa España, La Unión, La Fe, La Gloria, El Obrero, Las Cachamas, Las Brisas, Buenos Aires Parte Alta y Parte Baja, Mis Esfuerzo, Subestación, Alamos, Monserrate,",
    "Nom Responsable": "Wladimir Ledesma H.",
    "Fecha y hora esperada": "29/07/2020",
    "Inicio": "2020-07-29T06:00:00",
    "Fin": "2020-12-31T18:00:00",
    "Horas": "9",
    "Estado": "ACTIVA",
    "Fecha Registro": "29/07/2020",
    "Explicación": "Se distribuye de una tanque elevado llamado ZONA NORTE independiente de 1000m3 en horario de 6:00am a 11:00 y de 14:00 a 18:00",
    "Barrio": "Samper, La Victoria, Casa Blanca, Villa España, La Unión, La Fe, La Gloria, El Obrero, Las Cachamas, Las Brisas, Buenos Aires Parte Alta y Parte Baja, Mis Esfuerzo, Subestación, Alamos, Monserrate,",
    "Nom Contratista": "Aguas Nacionales EPM S.A. E.S.P. \"Proyecto Aguas del Atrato\"",
    "Tipo aviso": "Comunicado",
    "latitud": 5.645916,
    "longitud": -76.699985
  },
  {
    "Impacto": "Bajo",
    "Circuito": "Ciudadela MIA",
    "Servicio": "Agua",
    "Motivo": "Cambio de macromedidor de salida de la PTAP",
    "Solicita": "ley 1712 del 6 de marzo de 2014 Ley de Transparencia y del Derecho de Acceso a la Información Pública",
    "N. Inst": 1.507,
    "Municipio": "Quibdó",
    "Dirección": "Ciudadela MIA (Sectores A, B, C, D y E)",
    "Nom Responsable": "Jeidy Yakelin González Mena",
    "Fecha y hora esperada": "04/12/2020",
    "Inicio": "2020-11-04T10:00:00",
    "Fin": "2020-11-04T12:00:00",
    "Horas": "2",
    "Estado": "ACTIVA",
    "Fecha Registro": "04/12/2020",
    "Explicación": "El suministro se vio afectado por cambio de macromdedidor de salida en la PTAP de Ciudadela MIA",
    "Barrio": "Ciudadela MIA (Sectores A, B, C, D y E)",
    "Nom Contratista": "Aguas Nacionales EPM S.A. E.S.P. \"Proyecto Aguas del Atrato\"",
    "Tipo aviso": "Comunicado",
    "latitud": 5.659094,
    "longitud": -76.652913
  },
  {
    "Impacto": "Medio",
    "Circuito": "Niño Jesús, Institucional, Margaritas, Centro y Séptima, Medrano Bajo, San Martín, Red Expresa",
    "Servicio": "Agua",
    "Motivo": "Lavado y desinfección de la Planta de Tratamiento de Agua Potable la Loma",
    "Solicita": "ley 1712 del 6 de marzo de 2014 Ley de Transparencia y del Derecho de Acceso a la Información Pública",
    "N. Inst": 8.277,
    "Municipio": "Quibdó",
    "Dirección": "Niño Jesús, Institucional, Margaritas, Centro y Séptima, Medrano Bajo, San Martín, Red Expresa",
    "Nom Responsable": "Jeidy Yakelin González Mena",
    "Fecha y hora esperada": "26/01/2021",
    "Inicio": "2021-01-26T07:00:00",
    "Fin": "2021-01-26T19:00:00",
    "Horas": "0,5",
    "Estado": "ACTIVA",
    "Fecha Registro": "22/01/2021",
    "Explicación": "Actividades establecidas en el cronograma de Mantenimiento y lavado de estructuras, dando cumplimiento al decreto 1575 del 2007 artículo 8 y 9, “Por el cual se establece el Sistema para la Protección y Control de la Calidad del Agua para Consumo Humano”.",
    "Barrio": "Niño Jesús, Institucional, Margaritas, Centro y Séptima, Medrano Bajo, San Martín, Red Expresa",
    "Nom Contratista": "Aguas Nacionales EPM S.A. E.S.P. \"Proyecto Aguas del Atrato\"\nGestiones integrales de occidente S.A.S. E.S.P.",
    "Tipo aviso": "Comunicado",
    "latitud": 5.734923,
    "longitud": -76.678924
  },
  {
    "Impacto": "Medio",
    "Circuito": "Institucional, Comercial y Séptima",
    "Servicio": "Agua",
    "Motivo": "Lavado lavado y desinfección de la Planta de Tratamiento de Agua Potable Playita II por parte de personal contratista, para dar cumplimiento al decreto 1575 del 2007 artículo 8 y 9, “Por el cual se establece el Sistema para la Protección y Control de la Calidad del Agua para Consumo Humano”.",
    "Solicita": "ley 1712 del 6 de marzo de 2014 Ley de Transparencia y del Derecho de Acceso a la Información Pública",
    "N. Inst": 4.73,
    "Municipio": "Quibdó",
    "Dirección": "De la calle 35 a la calle 20 y de la Carrera 1 a la calle  10",
    "Nom Responsable": "Jeidy Yakelin González Mena",
    "Fecha y hora esperada": "28/01/2021",
    "Inicio": "2021-01-28T08:00:00",
    "Fin": "2021-01-28T11:00:00",
    "Horas": "0,125",
    "Estado": "ACTIVA",
    "Fecha Registro": "28/01/2021",
    "Explicación": "Se distribuye del tanque elevado de la Planta La Loma y durante el desarrollo del lavado no se realizó bombeo a este tanque desde Planta Playita, solo se bombeó desde Planta Loma; por lo tanto, no se pudo dar suministro permanente",
    "Barrio": "Yesquita, Roma, Miraflores, Roma, Yescagrande, Pan de Yuca, Cesar Conto, Tomas Pérez, Cristo Rey, Silencio, Kennedy, Chambacú, Chamblún, Alameda Reyes",
    "Nom Contratista": "Aguas Nacionales EPM S.A. E.S.P. \"Proyecto Aguas del Atrato\"\nGestiones integrales de occidente S.A.S. E.S.P.",
    "Tipo aviso": "Comunicado",
